Hotel_Name,Full_Review,Average_Score
ME London by Melia, Nothing   The hotel is GORGEOUS Sleek modern design The location is great and waling distance to the Somerset House Theater we saw kinky boots and close tube access as well The room was very large especially for the city Everything I expected and more The upstairs bar was fabulous ,9.2
ME London by Melia, cooked breakfast waiting time was too long On the first day my husbands breakfast was given to someone else and the serving staff noticed but never came to let us know or apologise we had to speak to the attendant 10 minutes later when it still had not arrived and then still had to wait over 10 minutes more for the breakfast to arrive and we were still charged two toothbrushes between three of us and had to wait until the day after to get an extra one secured by a note and not through reception as we had requested had a shirt and jacket pressed but the shirt was appalling had to request an iron and board to correct this although they apologised and refunded the cost of the pressing we should not have been put in that predicament was not able to find a bottle opener so consequently we did have anything out of the minibar and after everything could not be bothered to ask reception for one used Tesco express across the street instead booked taxi to heathrow through hotel and was charged 25 more going than when we came   location friendly staff comfortable bed ,9.2
ME London by Melia,  A beautiful hotel with an amazing staff The reception area was stunning My room and view were breathtaking This hotel is perfect for a couple or someone traveling solo ,9.2
ME London by Melia, Corridors a little too dark could hardly see signs for room numbers  Good location for Covent Garden Great for young crowd Suite had great bathroom and TV s Amazing reception,9.2
ME London by Melia,  Lovely location the entrance and reception absolutely stunning but our room was slightly disappointing couldn t open window air conditioning ok but got cold etc the neighbours had adjoining door and slammed it shut so many times that it made you jump out of your skin and at 3 30 a group of men decided to have an argument in the corridor outside our door There wasn t a bath and after all our walking would have loved a long soak Sandro made our stay special he had remembered us from our visit before and left us a welcoming present thank you you are a gentlemen a star look forward to seeing you again,9.2
ME London by Melia, there was nothing we did not like   Staff were extremely attentive Facilities were top class Welcome and check in complimentary drink was much appreciated Room was comfortable and very tastefully decorated The rooftop bar and view was amazing if I re visit very likely i would reserve a table ,9.2
ME London by Melia, It wasn t clear where the various bars or restaurants were located in the hotel as there didn t appear to be an obvious sign or map To improve the card function for the lift the sleeve for the card given to the guests could possibly have written on it Insert then remove card to press for floor Because it wasn t particularly clear how this system worked   We were really happy with how the staff responded to our requirements throughout our stay The breakfast was very good The in room service was excellent ,9.2
ME London by Melia, Didn t like how when we checked in that they took the price of the room plus 100 as I wasn t told at anytime that was going to happen so when I told them I didn t have the extra 100 in the bank I was made to feel uncomfortable and embarrassed  I liked how the staff treated me and my wife like we were royalty ,9.2
ME London by Melia,  absolutely amazing hotel from the moment you arrive outside to the moment you leave there is nothing that is too much trouble for the staff to do for you stunning interior collest roof top bar in the city amazing food and the rooms wow also so quiet although right in the centre of everthing ,9.2
ME London by Melia, Ordered an egg bacon sandwich to the room for breakfast which came toasted bacon was tasteless egg over cooked Also had to order tea for room which was excellent tea but 11 for 2 as there is only a coffee machine in room which we couldn t get to work but apparently does tea too  Staff very helpful loved the rooms facilities ,9.2
ME London by Melia, Two gripes no tea bags in room not everyone is a nesspresso lover The Hungarian Waitress in the Radio Bar poured our bottle of Lauren Perrier Champagne to empty in half an hour Way too fast and unclassy obviously this was to make us buy another bottle which we did but thereafter we took charge of our own refilling Waitress apart Radio Bar is fantastic   Hotel Staff fabulous from meet and greet to first floor front desk Internal architecture is just awesome wow ,9.2
ME London by Melia, When we checked in it was hard to understand the English of the man checking us in and he tried to get us to upgrade and we ended up in a room for the disabled but my wife would not let me complain ,9.2
ME London by Melia, The staff forgot to turn the room over properly on our second day towels were taken away but not replaced used toiletries not replaced and a few other niggly problems we complained about like no mirror in the room so they had to send one up specially but when I complained they didn t apologise or offer a discount on bill or offer is anything like a drink to say sorry   Hotel was fashionable and modern,9.2
ME London by Melia, Nothing   Fabulous hotel staff very welcoming Wee glass of prosecco when checking in Well appointed hotel in the heart of London Beautiful comfortable room with luxurious bed gorgeous Met Andrew one of the managers in the Radio rooftop bar He took some photos for us with the great views Had a chat with him and told him we were going to see Ed Sheeran at Wembley then flying out to Portugal He was lovely and gave us a wee card and gift in our room which was a lovely gesture When checking out the receptionist was very helpful and polite and wrote down her email address for us if we wanted to rebook Absolutely stunning hotel the attention to detail was wonderful and the staff were all well trained in customer service Will definitely return 10 out if 10 well deserved Oh and Ed concert was amazing and Portugal was hot and sunny ,9.2
ME London by Melia,  Everything Beautiful and modern very clean smelt lovely Glass of proseco on arrival reception staff lovely All staff highly professional yet welcoming and very helpful ,9.2
ME London by Melia, Check in by the receptionist room didn t match what was booked basics such as a tv took 2 days to fix cups left dirty Nespresso machine didn t work list goes on   Location,9.2
ME London by Melia,  Excellent hotel and staff nothing was too much trouble From the reception we were taken to our room and shown all the facilities service with a smile and a complimentary cocktail at one of the wonderful bars ,9.2
ME London by Melia, The TV didn t work properly had to call someone daily to sort out our blue tooth and remote I didn t pay for a handicap room but my bathroom had bars all over which made showering a major inconvenience The roof top bar was WAY over priced   The staff were super friendly and professional location was amazing rooms were great most comfy bed ever,9.2
ME London by Melia, The bed was a little too hard for our comfort but everything else was amazing   The hotel itself and the staff truly make this venue so impressive We were greeted so warmly by everyone and they always ensured we had what we needed Thank you for making our trip so special ,9.2
ME London by Melia, It was made unclear to me when booking the type of room I was paying for I asked for a room with a lounge area and upgraded to acheive this but still failed to have one I complained when checking out and given a 10 00 refund although the upgrade cost me 70 00   The staff are all very proffessional especially the doorman who went out of his way to find me a taxi as the Prudential cylcle ride on this day had made it difficult,9.2
ME London by Melia, Food in radio bar wasn t great or much of a selection and over priced for what you get Should get breakfast included when paying 270 for a double room   Really liked the hotel and facilities and staff very helpful and friendly will definitely stay there again and recommend ,9.2
ME London by Melia,  Location excellent close to restaurants and theatres,9.2
ME London by Melia,  Brilliant staff friendly and helpful great room could not fault it ,9.2
ME London by Melia, Sometimes slow service 5 with No spa pool   Location and Interior Design,9.2
ME London by Melia, Nothing best hotel I have stayed in in London   Reception Customers service Beautiful rooms ,9.2
ME London by Melia,  Everything,9.2
ME London by Melia,  chic,9.2
ME London by Melia,  Reception area spectacular Rooms terrific very clean ,9.2
ME London by Melia, Putting key card in lift It never worked  Beautiful decor,9.2
ME London by Melia, A little dark and consequently hard to work out how to get around the hotel  ,9.2
ME London by Melia, N A  Great location and great staff You have to go to the Radio bar and STK restaurant both are fantastic ,9.2
ME London by Melia, Pillow on bed was heavily stained Waited a long period on check out   The balcony and the turn down ,9.2
ME London by Melia, Mini bar charges excessive Did not use   Decor staff sound proofing of room location,9.2
ME London by Melia, No kettle for hot water in the room   We loved the rooftop bar,9.2
ME London by Melia, Nothing  Very helpful and friendly staff,9.2
ME London by Melia, Breakfast Room wasn t as nice as rest of hotel  Very clean and staff very accommodating,9.2
ME London by Melia,  Excellent staff the room was very stylish and comfortable and the food was amazing ,9.2
ME London by Melia,  Concept and location is great Enjoy the roof ,9.2
ME London by Melia, Nothing it was literally perfect   Room and staff were amazing STK Radio roof bar were real highlights ,9.2
ME London by Melia,  Great staff service was fabulous No request was a problem Rooftop bar has amazing views and a great place to unwind after a day out ,9.2
ME London by Melia,  The service ,9.2
ME London by Melia,  Huge bath tub,9.2
ME London by Melia, The price  The reception and the staff,9.2
ME London by Melia,  Nothing was too much Andre in reception was amazing totally perfect hotel,9.2
ME London by Melia,  Cocktails at the rooftop bar STK restaurant and fab room service ,9.2
ME London by Melia,  Bed was very comfortable Breakfast supberb Excellent and good quality toiletries ,9.2
ME London by Melia, Nothing not to like  Many 100 satisfied returns,9.2
ME London by Melia, The room was very small and didnt have a wardrobe but the view was stunning which made up for it all  ,9.2
ME London by Melia,  The pillows The bed was huge Xx,9.2
ME London by Melia, Nothing  Everything ,9.2
ME London by Melia, Size of the room  The balcony and room service,9.2
ME London by Melia,  I didn t have breakfast in the hotel ,9.2
ME London by Melia, The room was on the top floor and therefore we had loud noise from the rooftop bar through the night   Beautiful hotel luxurious,9.2
ME London by Melia, Didnt know we had to pay a 420 room deposit for a room that costed us 320 to stay Please be aware of this when staying  ,9.2
ME London by Melia, We are smokers and it was great to have our own balcony to relax  Very centre,9.2
ME London by Melia, small room no spa with swimming pool   the entourage and the location next to SOHO and the toproof bar ,9.2
ME London by Melia, Breakfast very expensive ,9.2
ME London by Melia, Nothing  Quality hotel from moment of arrival to check out rooftop bar amazing will be returning as soon as possible ,9.2
ME London by Melia,  Everything,9.2
ME London by Melia, Nothing  Everything,9.2
ME London by Melia, Nothing  Great hotel in a good location,9.2
ME London by Melia,  Excellent customer service and accommodation but drinks food too costly ,9.2
ME London by Melia,  Staff couldn t do enough for us and the room was very spacious and modern ,9.2
ME London by Melia,  Mini bar was amazing along with everything else couldn t be happier it is way better in person,9.2
ME London by Melia, Beware of having lit cigarettes thrown down on you from the rooftop bar Made it feel a bit 3 star when you re trying to enjoy the balcony  ,9.2
ME London by Melia, The price  The steak,9.2
ME London by Melia,  The roof bar was buzzing great way to end the night,9.2
ME London by Melia,  The shower was rain effect and the pillows were just the right softness Staffs were also really friendly ,9.2
ME London by Melia,  They made my partners birthday sensational will be going back very soon ,9.2
ME London by Melia,  The staff are very professional and helpful the suite we were in was immaculate Great Experience and will definately use in the future ,9.2
ME London by Melia, No disadvantages  The bed is huge and the view excellent The staff were efficient especially Piotr the concierge ,9.2
ME London by Melia, The staff tried to enter my room and the water pressure in the shower wasn t great   The location was great the room was modern and well sized ,9.2
ME London by Melia, Restaurant is rather a Bar with eating and loud music which we have on the rooftop as well  Perfectly Designed Hotel in outstanding location,9.2
ME London by Melia, Tea making facilities not available only coffee  ,9.2
ME London by Melia, Nothing  Everything staff were great nothing was too much trouble,9.2
ME London by Melia, Bar beneden is ongezellig  locatie is perfect,9.2
ME London by Melia, Breakfast quality was limited and service was understaff   State of the art hotel in terms of comfort and style,9.2
ME London by Melia,  Fantastic staff they went the extra mile to make my stay very special,9.2
ME London by Melia,  Style and location,9.2
ME London by Melia,  ME hotel London is the best hotel we stayed for 4 nights and regularly stay Staff are amazing as is service decor and ambience ,9.2
ME London by Melia,  The staff were very attentive and particularly kind to the children ,9.2
ME London by Melia, Breakfast wasn t good not enough food variety For the amount of money paid for breakfast only  Welcoming staff and hotel modern design,9.2
ME London by Melia,  The staff were very helpful and everybody was happy,9.2
ME London by Melia, Nothing  The concierge service was amazing ,9.2
ME London by Melia,  Everything was outstanding,9.2
ME London by Melia, Loved everything  Everything But most of all the staff,9.2
ME London by Melia, Better view ,9.2
ME London by Melia, The fact I had to leave  Amazing staff unbelievable hotel Worth every penny ,9.2
ME London by Melia, TV and music control very temperamental heating Controls did not work   Really modern rooms and fantastic modern design Hotel ,9.2
ME London by Melia, nothing it was perfect  the design of the hotel in the reception was amazing,9.2
ME London by Melia,  Excellent customer relationship management by in room dining,9.2
ME London by Melia, The Bluetooth in the room didn t work  Loved that there was sky sports in the rooms,9.2
ME London by Melia, Dark lights in the hotels ,9.2
ME London by Melia, lifts took a while to get to your floor  Staff very helpful,9.2
ME London by Melia, nil  Simply a great experience,9.2
ME London by Melia,  Fabulous hotel Friendly staff Clean Great atmosphere,9.2
ME London by Melia, Small bottles of water  Shower,9.2
ME London by Melia, Slow wifi this time   Third stay All excellent Thank you ,9.2
ME London by Melia, n a  Glass of fizz on arrival Amazing reception space,9.2
ME London by Melia, No tea coffee machine in the room and very expensive breakfast ,9.2
ME London by Melia, Nothing  Staff facility design and location,9.2
ME London by Melia, Nothing  Staff were extremely helpful polite and friendly Room was spacious with an amazing view of the city ,9.2
ME London by Melia,  This hotel and staff are faultless You get what you pay for in a nutshell Best ever experience of hotel,9.2
ME London by Melia, Breakfast very poor  Hotel was very good so were staff,9.2
ME London by Melia, Gym is too small  Excellent location impressive lobby hall warm and friendly welcome at reception,9.2
ME London by Melia,  Everything was perfect ,9.2
ME London by Melia,  Bed very comfy staff were perfect and very helpful and the hotel appearance was also perfect,9.2
ME London by Melia, Bed had a split in the middle when supposed to be a double bed  ,9.2
ME London by Melia,  Amazing level of service received overall,9.2
ME London by Melia, ,9.2
ME London by Melia, Having to leave  Fantastically quiet and comfy with the largest beds on the planet ,9.2
ME London by Melia, Could have let us see the fireworks  ,9.2
ME London by Melia,  The location,9.2
ME London by Melia, The pillows were a little to hard ,9.2
ME London by Melia, poor breakfast  the interior,9.2
ME London by Melia, No iron  Lovely room,9.2
ME London by Melia, very gloomy atmosphere definitely for the more raucous of society ,9.2
ME London by Melia, Radio bar staff were quite rude ,9.2
ME London by Melia,  Excellent atmosphere Roomspace,9.2
ME London by Melia, It was too dark and insufficient Christmas feel  ,9.2
ME London by Melia,  Amazing service from start to finish Perfect location Modern clean luxurious facilities Would highly recommend to anyone well worth the money ,9.2
ME London by Melia, Need xtra lighting and magnifying mirror in bathroom  Size of room ,9.2
ME London by Melia, Price of breakfast  Loved the cool modern interiors room was comfortable linen on bed good Quality toiletries,9.2
ME London by Melia, We had to leave   It was just right ,9.2
ME London by Melia, Everything is excellent  Repeat stay We like everything ,9.2
ME London by Melia, Not applicable  Fantastic hotel great location wonderful staff,9.2
ME London by Melia, Nothing  Everyone was Wet friendly helpful and professional,9.2
ME London by Melia, Black interiors  Facility very clean,9.2
ME London by Melia, Spa not available Very disappointing for a 5 star hotel  Great roof bar,9.2
ME London by Melia,  Love the location of the hotel and the rooftop terrace The beds are also very comfortable ,9.2
ME London by Melia, 3 lifts yet they seemed to take forever   Staff very friendly breakfast was great Loved the balcony as well ,9.2
ME London by Melia, Price a little lower  Room was amazing The steak in STK was out of this world ,9.2
ME London by Melia, Leaving   Staying ,9.2
ME London by Melia, Slight noise from an adjoining room   Beautiful spacious room with a comfortable bed Pleasant and helpful staff ,9.2
ME London by Melia, High room price  All very exclusive and luxury Staff was extremely helpfull and kind ,9.2
ME London by Melia,  Amazing customer service stunning hotel and rooftop bar Will defintely be returning ,9.2
ME London by Melia, N A  The service from all staff was incredible all so polite and friendly and always happy to help Thank you ,9.2
ME London by Melia,  Location is amazing Staff are friendly Breakfast is lovely Room is really nice,9.2
ME London by Melia,  perfectly located beautiful hotel design very good customer service great roof top bar,9.2
ME London by Melia, It s location is great ,9.2
ME London by Melia, N A ,9.2
ME London by Melia,  Was a fantastic place to stay beautiful views and room Would recommend highly,9.2
ME London by Melia,  Staff was a exceptional friendly courteous efficient Sleek modern comfortable rooms Great roof bar,9.2
ME London by Melia, Too many things for sale in room  Amazing roof bar,9.2
ME London by Melia, N A  This hotel was absolutely amazing,9.2
ME London by Melia,  Staff couldn t be more helpful and nice nothing was ever an issue Such a lovely place stunning ,9.2
ME London by Melia, Cheaper bar and food prices  Didn t like the cost of snacks in the room,9.2
ME London by Melia, We liked everything Really   Everything was very good ,9.2
ME London by Melia, Room service was late  Everything,9.2
ME London by Melia, bit pricey but it is central london  luxurious hotel friendly helpful staff trendy radio bar,9.2
ME London by Melia,  Very impressive reception area and staff were very helpful,9.2
ME London by Melia,  Excellent location for our visit to ROH,9.2
ME London by Melia, Nothing  Everything,9.2
ME London by Melia, Cost haha  Radio rooftop STK Hotel Location,9.2
ME London by Melia,  Great service and room was lovely and super modern for a change of scenery,9.2
ME London by Melia,  Great bedroom layout,9.2
ME London by Melia,  Everything was perfect the staff where amazing and very helpful worth every penny You will feel like a Celeb ,9.2
ME London by Melia, No kettle in the room or tea selections  Small personalized gesture which was so lovely ,9.2
ME London by Melia, not quite so loud music in restaurant  excellent staff brilliant steaks in restaurant ,9.2
ME London by Melia, Paid over 400 and no breakfast included Lol Really   Radio bar,9.2
ME London by Melia,  Very modern hotel suited for young couples,9.2
ME London by Melia, STK restaurant full of people shouting to make themselves heard over the pounding background music  Beautiful room,9.2
ME London by Melia, Couldn t fault   Great views and good service Friendly staff ,9.2
ME London by Melia,  Very clean and stylish great experience,9.2
ME London by Melia,  The rooftop bar was the Icing on the cake,9.2
ME London by Melia, Public areas were very dark and oppressive All the black marble certainly made an impact   Staff were very friendly and helpful,9.2
ME London by Melia, Nothing honestly nothing to complain about   Great rooms with really comfy bed Spacious for London and amazing location ,9.2
ME London by Melia, Radio bar is very noisy  ,9.2
ME London by Melia,  Trendy great location,9.2
ME London by Melia,  Hotel reception has to be experienced incredible design and service to match rooms very comfortable and relaxing,9.2
ME London by Melia, The room is not sound proof Can hear the noise of vacuum cleaning in the morning   The bar the food are pretty good ,9.2
ME London by Melia, Felt a little like a prison with dark corridors and guards everywhere   Impressive design,9.2
ME London by Melia, Nothing   Everything ,9.2
ME London by Melia, Roof top bar waiting time to be served  Internal design exceptional security staff politeness location view,9.2
ME London by Melia,  Excellent location for theatres ,9.2
ME London by Melia, Too loude music in the corridor and inside the rooftop bar ,9.2
ME London by Melia,  atmosphere location service,9.2
ME London by Melia,  Liked everything Staff brill Nothing too much trouble,9.2
ME London by Melia,  Location ,9.2
ME London by Melia, Noise ,9.2
ME London by Melia, The common area to the rooms were rather dark kind of spooky   Very nice bright rooms with good view from the balcony ,9.2
ME London by Melia,  Look this hotel best one I ve stayed in for ages,9.2
ME London by Melia, The smell in the lobby  ,9.2
ME London by Melia,  Great attention to detail Cool d cor Friendly and helpful staff,9.2
ME London by Melia,  Concierge Radio roof top In room massage Location,9.2
ME London by Melia, Breakfast too expensive The quality was not good  Lovely hotel for a romantic couple,9.2
ME London by Melia,  Awesome rooms great staff swanky hotel Great rooftop cocktail bar ,9.2
ME London by Melia, Would have liked a pool  Room was quiet comfortable within easy reach all you d expect in a luxury city based hotel,9.2
ME London by Melia, The pillows were hard  The bed was comfortable,9.2
ME London by Melia, The hangover   Great fun contemporary cool,9.2
ME London by Melia, Could not open window  ,9.2
ME London by Melia, Too modern and rooftop Radio Bar music to loud and tapas really not very good at all  ,9.2
ME London by Melia,  The attention to detail in the hotel was second to none I cannot fault it in anyway There arn t many other places i d rather stay in London,9.2
ME London by Melia, It would receive at 10 but the service in the rooftop bar is extremely slow and very expensive ,9.2
ME London by Melia, Absolutely noting our stay was perfect  Staff were amazing friendly and professional,9.2
ME London by Melia,  Everything was excellent,9.2
ME London by Melia, Black modern interiors lacked warmth ,9.2
ME London by Melia,  It was simply the perfect hotel with amazing service ,9.2
ME London by Melia,  The balcony in the room the staff are friendly,9.2
ME London by Melia, Difficult light controls in rooms  Ambience,9.2
ME London by Melia, bar staff very poor in the restaurant and the roof bar waited over 25 mins to get served  Fantastic location and very trendy,9.2
ME London by Melia, Nothing  Everything,9.2
ME London by Melia, coffee machine broken ,9.2
ME London by Melia, Everything was fantastic  Excellent stay very helpful and friendly staff,9.2
ME London by Melia,  Great location facilities and staff but nothing beats the awesome beds Super comfy and huge ,9.2
ME London by Melia,  Staff were very friendly and extremely helpful breakfast in bed was fantastic Overall a lovely hotel ,9.2
ME London by Melia,  The staff are so friendly,9.2
ME London by Melia,  Can not fault a thing,9.2
ME London by Melia,  the hotel was lovely and would stay again breakfast was also very nice,9.2
ME London by Melia, Manca sauna piscina  La reception stupenda,9.2
ME London by Melia, Room to small Smaller than it looks on website  Atmosphere,9.2
ME London by Melia, n a  total hotel,9.2
ME London by Melia, Nothing  Really cool modern hotel perfect location,9.2
ME London by Melia,  Excellent staff Very quite rooms,9.2
ME London by Melia, Dark corridors   Location ,9.2
ME London by Melia,  Excellent staff and environment,9.2
ME London by Melia, the fake nespresso capsules in the rooms   bars and restaurant,9.2
ME London by Melia,  Bed and sheets were super luxurious,9.2
ME London by Melia, Nothing  Great service and friendly staff Superb facilities,9.2
