Hotel_Name,Full_Review,Average_Score
Strand Palace Hotel, Attitude of certain front line staff  The location was brilliant,8.1
Strand Palace Hotel,  Executive room had a good size bed and plenty of room,8.1
Strand Palace Hotel, Room to small for the price Had to change rooms as the shower was broken Breakfast was cold  Location,8.1
Strand Palace Hotel, The room was rather cramped for the price but for central London it was not unexpected   Excellent location and generally nice hotel ,8.1
Strand Palace Hotel,  the staff were friendly the rooms were clean very good value for the money it was close to every thing,8.1
Strand Palace Hotel, The twin beds were very small and moved too easily   Breakfast lovely Staff very helpful,8.1
Strand Palace Hotel, Dusts on the room walls ,8.1
Strand Palace Hotel, The little window felt dark  Where it was,8.1
Strand Palace Hotel, The lifts were slow   The staff were really friendly and the breakfast was amazing,8.1
Strand Palace Hotel,  Upgraded Excellent friendly and helpful staff Everything we needed in th rm with good level of comfort ,8.1
Strand Palace Hotel,  The staff were very friendly and kind hotel was perfect lovely,8.1
Strand Palace Hotel, Small and dark rooms small beds  Excellent location and staff,8.1
Strand Palace Hotel, No air con so unlikely to stay again  Good location,8.1
Strand Palace Hotel, Some staff on front desk are not friendly ,8.1
Strand Palace Hotel, Some bar staff are rude  Breakfast and fish tank,8.1
Strand Palace Hotel, N a  The staff at the reception,8.1
Strand Palace Hotel, A more comfortable and larger double bed  The location and the friendliness of the staff ,8.1
Strand Palace Hotel, It was really cold even with the heating on  Bed was extra comfy ,8.1
Strand Palace Hotel, Room to small price of cocktails  Location,8.1
Strand Palace Hotel,  Very efficient and friendly,8.1
Strand Palace Hotel, Apart from a lack of a mini bar in my room but I was staying solo on short notice so easily not an issue really   Excellent location and comfy rooms,8.1
Strand Palace Hotel, Room s somewhat outdated and small   Central in London breafast excellent ,8.1
Strand Palace Hotel, Had to wait 45 mins for room The room could of been cleaner   Service was good Staff were friendly ,8.1
Strand Palace Hotel, Dinner menu was a little pricy We went out for dinner to a more reasonably priced meal  Central location Staff was very nice,8.1
Strand Palace Hotel,  The staff were very friendly and service was good The location was great and hotel of a high standard,8.1
Strand Palace Hotel, Firm mattress on bed  Friendly staff Breakfast was A1 ,8.1
Strand Palace Hotel, Ways to order movies on the TV  Bed was very comfy Snacks very tasty,8.1
Strand Palace Hotel, Mattress was a bit too hard for my liking   Friendly staff ,8.1
Strand Palace Hotel, I wish the room had of had a bath but that wasn t a major deal  The bed was super comfy the gym was great as well as the breakfast,8.1
Strand Palace Hotel,  2nd stay at this hotel set in central location easy access to tube ect within easy walking distance to Leicester Square and numerous restaurants,8.1
Strand Palace Hotel, Nothing  Good all round service,8.1
Strand Palace Hotel, Breakfast took a long while and over cooked poached eggs ,8.1
Strand Palace Hotel, Coffee at breakfast brown water   The Staff and location,8.1
Strand Palace Hotel, The doorman Not a gentleman on the contrary   The rooms the simplicity and location,8.1
Strand Palace Hotel, Very long queue at check in with staff taking far too long  Excellent buffet breakfast,8.1
Strand Palace Hotel, the fact that it was so small toilet paper e g not in reach of toilet   location,8.1
Strand Palace Hotel,  Friendliness of the staff and location of the hotel,8.1
Strand Palace Hotel, The visit was for my husbands birthday Keith and I were pleasantly surprised and enjoyed how helpful and caring everyone of the staff were  ,8.1
Strand Palace Hotel, the lifts had a mind of their own   Beds very comfy Friendly staff Good breakfast,8.1
Strand Palace Hotel, We waited for tea and coffee and gluten free bread at breakfast   Location is perfect Good breakfast Bedroom comfortable Served gluten free bread ,8.1
Strand Palace Hotel,  The hotel was super Location great Staff friendly and helpful,8.1
Strand Palace Hotel, Towels  Location cleanliness staff friendly and knowledgeable food good Room clean warm and provided toiletries ,8.1
Strand Palace Hotel, Price   Location,8.1
Strand Palace Hotel,  The location the value for money under 500 for five nights in London in a single room You are within walking distance of so much ,8.1
Strand Palace Hotel,  Fine,8.1
Strand Palace Hotel, Nothing   It s a great location Great service from all the staff Very good breakfast Very clean and comfortable ,8.1
Strand Palace Hotel, Room was a little small but price reflected this  Central Location friendly and efficient staff ,8.1
Strand Palace Hotel,  The deal we had made it value for money ,8.1
Strand Palace Hotel, Poor reception from staff when booking in ,8.1
Strand Palace Hotel, As with all big hotels it is rather impersonal   The hotel s central location makes it ideal for theatre goes or to explore central London ,8.1
Strand Palace Hotel, Japanese style room size  terrific location ,8.1
Strand Palace Hotel,  Lovely room Lovely breakfast overall enjoyed hotel,8.1
Strand Palace Hotel,  Central West End location was fantastic Walking distance from everything ,8.1
Strand Palace Hotel, my single room was small like regular hotels   You would feel like staying in colonial days with that retro feel,8.1
Strand Palace Hotel, Wifi can be quicker   The 24hours room service is so nice I ordered some foods at 1am than I get them 30mins late ,8.1
Strand Palace Hotel, Queuing for breakfast  Location great staff helpful room comfy and public rooms very god ,8.1
Strand Palace Hotel,  Friendly staff clean great breakfast ,8.1
Strand Palace Hotel, The bed was so hard  Location was fantastic,8.1
Strand Palace Hotel,  Excellent breakfast ,8.1
Strand Palace Hotel,  Location,8.1
Strand Palace Hotel, Room was a little small  Kind staff,8.1
Strand Palace Hotel, Bedroom was small and very noisy The bed was so hard it was like sleeping on a table  ,8.1
Strand Palace Hotel, Felt the room was a little small for the price  Best roast beef ever in the restaurant,8.1
Strand Palace Hotel, The opening of the toilet door design was terrible The room lighting was dark so didnt like it at all  ,8.1
Strand Palace Hotel, King size executive didn t have a view only a brick wall with other windows room 479  Clean Friendly excellent location ,8.1
Strand Palace Hotel, There wasn t a fridge in the room No extras in the bathroom  ,8.1
Strand Palace Hotel, Nothing   excellent reception staff Clean comfortable rooms Lovely shower,8.1
Strand Palace Hotel, Disappointed that early check in and breakfast hadn t been recorded  Location was perfect,8.1
Strand Palace Hotel, Shower over a bath  Staff and service excellent,8.1
Strand Palace Hotel, It was a very windy day and the window in our room banged all night till we worked out what it was and filled the gap  ,8.1
Strand Palace Hotel,  Superb location with easy access to many attactions ,8.1
Strand Palace Hotel, The room  Location,8.1
Strand Palace Hotel, Room size needed a bath  Location convenience breakfast ok,8.1
Strand Palace Hotel, Hard Bed very expensive drinks small room  Staff Location Clean,8.1
Strand Palace Hotel, The double room was tiny  Cannot get past the location could not have been any better,8.1
Strand Palace Hotel, Breakfast was ok but nothing special ,8.1
Strand Palace Hotel, Noise out side the curtains in bedroom let to much light it  Friendly staff nice amothsphere quiet inside the hotel,8.1
Strand Palace Hotel, Breakfast wasn t included in price which was disappointing   Size of beds and the wardrobe spaces All utilities in room ,8.1
Strand Palace Hotel, the breakfast to expencive  very nice romms,8.1
Strand Palace Hotel,  Was all good,8.1
Strand Palace Hotel, Breakfast was identical every day and somewhat boring  The nice smell throughout the hotel,8.1
Strand Palace Hotel, Size of room deal said breakfast but when booked refused breakfast  Location,8.1
Strand Palace Hotel, Nothing  Situated right in centre of all we wanted to visit,8.1
Strand Palace Hotel, Bed not comfortable I  Staff are nice ,8.1
Strand Palace Hotel, first room was too small 877 and was not as advertised new room was adequate  Location,8.1
Strand Palace Hotel, Got the smallest room I have ever stayed in at any hotel Was nice and clean but very tiny  ,8.1
Strand Palace Hotel,  Excellent location and friendly and helpful staff ,8.1
Strand Palace Hotel, Nothing bad  Fabulous Courteous staff Friendly and helpful,8.1
Strand Palace Hotel, Nothing  We had a fantastic break the location was excellent and the staff were outstanding Thankyou,8.1
Strand Palace Hotel, Room service breakfast was poor but deducted from bill which was good   Lovely room great location for theatres ,8.1
Strand Palace Hotel,  Location,8.1
Strand Palace Hotel, Room too smal little value for money  Placed Central London,8.1
Strand Palace Hotel,  From check in to check out everything ran smoothly Breakfast was excellent ,8.1
Strand Palace Hotel, restaurant menu  breakfasts,8.1
Strand Palace Hotel, Room smaller than expected   Friendly staff very helpful ideal location for travelling around London,8.1
Strand Palace Hotel, It s very large and has a poor lounge ground floor  Location good For London a safe central play ,8.1
Strand Palace Hotel, Room was smaller than we usually have and the view from the room left a lot to be desired   Easy access to the theatres,8.1
Strand Palace Hotel,  Excellent room for what I paid comfy single Was given a lovely twin room Breakfast was good and all you could eat ,8.1
Strand Palace Hotel, Room very small and bathroom even smaller   Breakfast very good Great choice ,8.1
Strand Palace Hotel, There wasn t anything we didn t like   The welcome to the hotel was lovely everyone was friendly ,8.1
Strand Palace Hotel, Little light on the toiletries  Brilliant location for london theatres,8.1
Strand Palace Hotel, That we had to leave  Comfy room great location and fab staff,8.1
Strand Palace Hotel,  Excellent location,8.1
Strand Palace Hotel,  Great location lovely hotel friendly staff very comfortable room,8.1
Strand Palace Hotel, Hard pillows Prices of drinks in the bar  Great breakfast,8.1
Strand Palace Hotel, Prices of drinks in the bar  Good central hotel great breakfast,8.1
Strand Palace Hotel,  I have stayed at this hotel about 5 times now I love the location the service and the hospitality ,8.1
Strand Palace Hotel, lack of choice in vegetables in the carvery  Excellent location,8.1
Strand Palace Hotel,  Good selection for breakfast nice choice off teas in your room also very nice to have fresh bottled water every day ,8.1
Strand Palace Hotel, Noisy room Paper thin walls   Location,8.1
Strand Palace Hotel, TV was in the wrong position in relation to bed and seating   Great location very helpful staff clean and comfortable bed ,8.1
Strand Palace Hotel, The room was cold even with the small radiator on and very cold in the bathroom There was no plug for the bath  ,8.1
Strand Palace Hotel,  Location excellent Breakfast was very good ,8.1
Strand Palace Hotel, no view Small room Bathroom could do with being updated   Bed was fine Gin bar was also very good ,8.1
Strand Palace Hotel, The wifi was not working well  Great location,8.1
Strand Palace Hotel, Nothing  The Location is absolutely excellent,8.1
Strand Palace Hotel, Our room was so basic a premier inn is better and half the price And we were apparently upgraded  Where it was and the reception area,8.1
Strand Palace Hotel, A guest set the fire alarm off at 0340   Fantastic breakfast Excellent location for visiting London ,8.1
Strand Palace Hotel, rooms showed their age  excellent location and attentive staff,8.1
Strand Palace Hotel, Breakfast was a bit ordinary   Close to everything ,8.1
Strand Palace Hotel, Shabby general public areas Mixed indifference friendliness of staff Average value for money   Good location,8.1
Strand Palace Hotel, Very cowded and too expensive but it is London  Good breakfast gym available small but nice room ,8.1
Strand Palace Hotel, Our room was too cramped compared to others  ,8.1
Strand Palace Hotel, The double bed was more like two beds pushed together  Bed wasn t that comfortable but the breakfast was nice,8.1
Strand Palace Hotel, Shower poor drainage  Bed was comfy Disappointed with the shower slow water drainage,8.1
Strand Palace Hotel,  Great location,8.1
Strand Palace Hotel,  Overall Experience is Good ,8.1
Strand Palace Hotel, Wait to check in rush at 2pm so need extra staff ,8.1
Strand Palace Hotel,  Room Service was very quick,8.1
Strand Palace Hotel,  Friendly staff Excellent location cosy and comfortable room Will definitely return ,8.1
Strand Palace Hotel, no bedside table in our room  Close to theatre land and Covent garden ,8.1
Strand Palace Hotel, 1 No grout in bathroom floor tiles unhygienic floor 2 Clothes hangers did not fit in wardrobe with doors closed   Central location,8.1
Strand Palace Hotel,  Good location ,8.1
Strand Palace Hotel, More pillows Bigger shower screen  Location Reception staff,8.1
Strand Palace Hotel,  Brkfst wonderful co stanti e reception help ful n efficient,8.1
Strand Palace Hotel, can t think of anything  the bed was comfortable,8.1
Strand Palace Hotel, All good  Excellent breakfast and great location,8.1
Strand Palace Hotel,  Great location near theatre,8.1
Strand Palace Hotel, expensive breakfast as everywhere in London  ,8.1
Strand Palace Hotel,  Brilliant location Decent sized room Would definitely use again ,8.1
Strand Palace Hotel, Price n street noise outside   Staff were friendly n room was clean ,8.1
Strand Palace Hotel, N A  location friendly staff cleanliness EXCEEDED EXPECTATIONS,8.1
Strand Palace Hotel,  We were given a complimentary upgrade The bed in the executive room was very spacious The breakfast was delicious,8.1
Strand Palace Hotel,  Excellent staff,8.1
Strand Palace Hotel, Size of the double room tiny  Close to theatres restaurants etc,8.1
Strand Palace Hotel, Very hot room and shower head was quite dirty  Bed really comfortable,8.1
Strand Palace Hotel, All OK  All OK,8.1
Strand Palace Hotel, Restaurant food average  Staff good,8.1
Strand Palace Hotel, Nothing really   The staff concierge and the breakfast was awesome Not to mention the location it s very close to the central area ,8.1
Strand Palace Hotel, The small courtyard room   The quality of the food is good Also the Indian restaurant,8.1
Strand Palace Hotel, Nothing really   Very good breakfast Helpful reception staff Charming doormen ,8.1
Strand Palace Hotel, very small room crowded breakfast long time check in  location,8.1
Strand Palace Hotel, Noise from neighbors Sink was clogged Not enough light in bathroom Very small bathroom   Location staff bed ,8.1
Strand Palace Hotel, Breakfast was crowded and queing is not ok ,8.1
Strand Palace Hotel,  Good value for money wouldn t hesitate to stay again Staff were helpful ,8.1
Strand Palace Hotel, Paid for an executive room which was rather small and gloomy   Convenient location ,8.1
Strand Palace Hotel,  Excellent comfort Breakfast was extremely good with lots of choice Our whole experience was a pleasure,8.1
Strand Palace Hotel,  Location,8.1
Strand Palace Hotel, Breakfast was a little crowded  Good location in the centre of everything,8.1
Strand Palace Hotel, Being kept awake all night due to the pinging noise from a faulty lift indicator  Staff helpful when we had a problem,8.1
Strand Palace Hotel, Staff very happy and friendly and vey helpful ,8.1
Strand Palace Hotel, We don t think anything could be better  Both room and breakfast were very good,8.1
Strand Palace Hotel, i guess this is now typical of London but the cost was not value for money  The staff were very professional,8.1
Strand Palace Hotel, Air con very loud throughout the night   Location,8.1
Strand Palace Hotel,  Staff were excellent Location was perfect,8.1
Strand Palace Hotel, Duvets were too thin and small   Great location Staff friendly very clean hotel Breakfast was excellent ,8.1
Strand Palace Hotel, Hairdryer broken Too late to replace when I discovered it  Windows do open but won t stay open,8.1
Strand Palace Hotel, Nothing  Perfect location for theatres and Covent Garden restaurants ,8.1
Strand Palace Hotel,  Nice clean comfortable room excellent location to theatres,8.1
Strand Palace Hotel,  Superb breakfast friendly and knowledgeable staff especially the concierge ,8.1
Strand Palace Hotel, Nothing  Total package,8.1
Strand Palace Hotel, The bar prices and the rooms were on the small side  The staff were superb,8.1
Strand Palace Hotel,  The location is excellent and beds comfy,8.1
Strand Palace Hotel, Rooms tired Door handles bath taps and carpets very tired Rooms don t carry through from the very smart reception  ,8.1
Strand Palace Hotel, nothing  Friendly hotel and staff lovely room clean and comfortable excellent breakfast good location ,8.1
Strand Palace Hotel, Nothing everything was fine  The facilities and location,8.1
Strand Palace Hotel, Initial room at check in was damp and musty but the reception immediately changed our room  ,8.1
Strand Palace Hotel, Dirty windows on outside Mattress rock hard   Location and breakfast great,8.1
Strand Palace Hotel, very basic and dated the breakfast room was like an old school canteen but with hardly any staff Wouldn t return to this hotel  The location,8.1
Strand Palace Hotel,  Excellent location Single room upgraded from cosy to standard at no extra charge,8.1
Strand Palace Hotel, Executive kamer very outdated High prices for old and small room  Locatie top,8.1
Strand Palace Hotel, Carvery food very average  We asked for a quiet room and it certainly was wonderful Great breakfast,8.1
Strand Palace Hotel,  Great location was there with work so didn t use any facilities but it looked like a nice place,8.1
Strand Palace Hotel, It is very busy A lot of people everywhere and it took 30 minutes in line to check in   Very friendly staff perfect location,8.1
Strand Palace Hotel, As a regular visitor we have noticed many rooms particularly on the second floor are in need of renovation and decoration   location,8.1
Strand Palace Hotel, Room was very small  Decent breakfast,8.1
Strand Palace Hotel, For our purpose going to the RFH it was just what we wanted  Position Good double room small but very adequate and clean,8.1
Strand Palace Hotel,  Excellent shower quiet location of room for central London,8.1
Strand Palace Hotel, Cosy rooms not for the mature guests  Lunch best I have had in a long while ,8.1
Strand Palace Hotel, Hotel bit dated in places  Friendly staff,8.1
Strand Palace Hotel, Decor in hallway was shabby  Staff were exemplary,8.1
Strand Palace Hotel, Small room Bathroom is run down old crap Room service food was rubbish and nearly made me vomit   Good location ,8.1
Strand Palace Hotel, Size of rooms  General hotel facilities,8.1
Strand Palace Hotel,  Efficient service all as it should be ,8.1
Strand Palace Hotel, It was also rather like a cupboard  The room was quiet ,8.1
Strand Palace Hotel, No complaints   Great location for theatre and sightseeing ,8.1
Strand Palace Hotel, No Problems it met all our requirements  Excellent place to stay near Covent Garden and Drury Lane for the show ,8.1
Strand Palace Hotel,  good beds,8.1
Strand Palace Hotel, room sizes are small  location,8.1
Strand Palace Hotel, horrid pillows and bed very hard Room cold   friendly reception great location Room itself fine and shower good,8.1
Strand Palace Hotel, It s a bit run down and could do with refurbishment  Small and dated room but beds were comfortable excellent location for the price,8.1
Strand Palace Hotel,  Great Location Value for money,8.1
Strand Palace Hotel, mattress was too hard like sleeping on a board  service at the bar and restaurant,8.1
Strand Palace Hotel, 50 minutes waiting to check in   Location excellent Comfy beds though the room was on the small side ,8.1
Strand Palace Hotel,  great hotel rooms were lovely the bed was do comfy we missed breakfast,8.1
Strand Palace Hotel, Na  Staff all pleasant and courteous relaxed ambience,8.1
Strand Palace Hotel, Noisy Room Moved to another room Hairdryer Timed Out No Signs to Room From Main Lift No Minibar Door Key Timed Out  Breakfast Location,8.1
Strand Palace Hotel, A lot of noise in the rooms ,8.1
Strand Palace Hotel, Room was a little on the small side  Excellent location,8.1
Strand Palace Hotel, Toilet didnt work well  Location was great,8.1
Strand Palace Hotel, Comfy double is too claustrophic for us  Staff Breakfast Location Ambience Spotless room Comfy bed Toiletries,8.1
Strand Palace Hotel,  Location,8.1
Strand Palace Hotel,  Easy to get to Wembley by tube,8.1
Strand Palace Hotel, Expensive drinks and claustrophobic windowless lounge  Perfect for Theatres sightseeing and restaurants ,8.1
Strand Palace Hotel, Nothing  We stay there often Great location Nice atmosphere ,8.1
Strand Palace Hotel, The executive cooked breakfast wasn t very good at all The hot water was intermittent in the shower  ,8.1
Strand Palace Hotel, Waitin for check inn nd check out  The enviroment the location,8.1
Strand Palace Hotel,  Good food,8.1
Strand Palace Hotel, Room was at front of hotel so a little noisey  Room was fine but no bath,8.1
Strand Palace Hotel,  Great location rooms were spotless and staff were all lovely ,8.1
Strand Palace Hotel,  Really good breakfast lovely fish tank in reception ,8.1
Strand Palace Hotel, nothing  excellent location,8.1
Strand Palace Hotel,  Power shower,8.1
Strand Palace Hotel, Calling 3 times for milk and sugar   Bed was nice,8.1
Strand Palace Hotel, The bar was noisy and uncomfortable For an Executive room there was no evening tidy turndown service  The Concierge service was excellent,8.1
Strand Palace Hotel, the bed could have been more comfortable ,8.1
Strand Palace Hotel,  Very comfortable bed and Windows that opened ,8.1
Strand Palace Hotel,  The lovely room a special upgrade as an 80th birthday treat The lounge bar a nice place to relax Nice breakfast lots to choose from ,8.1
Strand Palace Hotel, Beds were uncomfortable and had to scare with are 5 year old  The location was amazing,8.1
Strand Palace Hotel, Room was very warm and Abit Small but otherwise very good  Liked the Location the hotel the staff the food all was ok and enjoyed it,8.1
Strand Palace Hotel, The room was cozy   Great staff friendly and efficient ,8.1
Strand Palace Hotel, Only one night stay  Upgrade Breakfast excellent,8.1
Strand Palace Hotel, Big queue at check in This is not acceptable Ugly view from room   Comfy bed Excellent breakfast ,8.1
Strand Palace Hotel,  Excelent location Nice rooms,8.1
Strand Palace Hotel, A very massive check in queue at arrival  Room was clean staff were friendly attentive,8.1
Strand Palace Hotel,  The location is good close to charing cross station I had tesco express pharmacy starbucks all close to the hotel ,8.1
Strand Palace Hotel, Small room   Location ideal ,8.1
Strand Palace Hotel,  Location,8.1
Strand Palace Hotel, decor in room  fantastic location,8.1
Strand Palace Hotel, Reception and bar staff were not very helpful   Location hot shower,8.1
Strand Palace Hotel, Meals were rather expensive   Location is excellent for central London and is within easy reach of theatres ,8.1
Strand Palace Hotel, Faulty fire alarm going off in the middle of the night   Good location,8.1
Strand Palace Hotel, Rooms were small for the price and drinks highly overpriced  Was extremely well placed for the show we went to see,8.1
Strand Palace Hotel,  Friendly Staff comfortable bed and all good and you will see me again Thank you ,8.1
Strand Palace Hotel, The bed was hard The d cor in the bedrooms could be improved  ,8.1
Strand Palace Hotel,  Bed comfortable breakfast good as was location,8.1
Strand Palace Hotel, Dinner ,8.1
Strand Palace Hotel, Small bed only one duvet   The room was clean the bathroom big and clean hotel was in a very good place,8.1
Strand Palace Hotel, The price off the breakfast  The location and the staff made us feel special,8.1
Strand Palace Hotel, Grumpy staff forgot our breakfast   Room comfort,8.1
Strand Palace Hotel, The single room which I had was slightly bigger then a cupboard   The location is perfect for a visit to London ,8.1
Strand Palace Hotel, the price of breakfast too expensive could hear street noise couldn t see how to close windows   room comfortable clean value for money ,8.1
Strand Palace Hotel, Rooms are a bit tired could do with updating  Location fantastic and staff very good ,8.1
Strand Palace Hotel, Cleanliness food and service mediocre at best   Location was ideal for theatres,8.1
Strand Palace Hotel,  The hotel was in a brilliant location for the Theatres very friendly and reasonably priced ,8.1
Strand Palace Hotel, It all seemed good   Great staff on front desk Loved Gin Palace Doormen,8.1
Strand Palace Hotel, Noisy neighbour  Bed comfy bathroom lovely and clean,8.1
Strand Palace Hotel, Only negative was being served barely warm tea for breakfast  Everything was great,8.1
Strand Palace Hotel, Felt a bit old  Very nicely located for going to the theatre,8.1
Strand Palace Hotel, Can hear a little bit from another room but only a tiny bit   Location is great Staff very friendly Concierge service was great ,8.1
Strand Palace Hotel,  Excellent location Clean room and comfortable bed I will stay in this hotel again next time I visit London ,8.1
Strand Palace Hotel, Room  Location very close to theatres and attractions,8.1
Strand Palace Hotel, When we arrived they hotel was overbooked so my sister and I had to stay in two different rooms   The location the staff,8.1
