Hotel_Name,Full_Review,Average_Score
Park Grand London Kensington, Only fault window loovers had duck tape on them to seal Looked poor  Excellent verry helpful will stay there again Best breakfast this year and I have stayed in quite a few nice hotels this year,8.4
Park Grand London Kensington, No fault of the hotel but we had a room next to a family who also had relatives in another room Every day and night there was knocking banging on walls slamming doors yelling kids up til as late as 2am When we complained the manager said they wont stop so it is easier to move you They did move us but I feel they could have done more to stop those who were causing it   Rooms are spacious Beds are very comfortable Breakfasts are excellent,8.4
Park Grand London Kensington, The lift kept getting stuck on a floor but stairs were good exercise   Extremely professional and helpful staff always with a smile on their face impressed ,8.4
Park Grand London Kensington,  The staff were wonderful Nothing was to much trouble The rooms were lovely Because it was birthday they left me a card and chocolates on arrival The bed was so comfy I didn t want to leave I will definitely be returning,8.4
Park Grand London Kensington,  The staff was wonderful EVERYTHING we asked for they said right away with my pleasure The location was phenomenal with the tube train station very close Easy access to all tourist sites The location was clean and it felt safe ,8.4
Park Grand London Kensington, I cant think of anything that I didnt like  I found the staff very attentive and accommodating and eager to help also I like the comfort of the room and the facility within the room its my favourite place sofar,8.4
Park Grand London Kensington, No room information of how things worked eg took us a while to realise bed side lamp switches were located underneath   The hotel was close to underground and staff were friendly ,8.4
Park Grand London Kensington, Nothing bad to report I ll definitely be back   Friendly staff great location super comfy bed They even upgraded us for free Metro was also only a minute s walk away ,8.4
Park Grand London Kensington, The garbage trucks come early in the am and it is very noisy The bathroom is poor designed as there is no room to put anything and the sink design makes everything wet  ,8.4
Park Grand London Kensington,  Seamless check in friendly staff fantastic location near Earl s Court station South Kensington close to shops buses restaurants quiet spacious room and excellent bathroom Will recommend to fellow travellers as a wonderful London base ,8.4
Park Grand London Kensington, Everything was perfect   The staff was realy good very good and very friendly It is also very well located near the tube Picadilly line to go to the town ,8.4
Park Grand London Kensington, Didnt appreciate the boilers not working midway through having a shower The heating wasn t on for the first night and parking facilities were limited   Value for money with the facilities provided such as the microwave fridge wifi and location was a bonus too ,8.4
Park Grand London Kensington, I did the reservation via agency on the begining and my reservation was send to the other hotel Executive rooms aparently the same owner I do not how but in reception they found my lost reservation there anyway i did again by booking it works perfectly and the hotel was very good   rooms,8.4
Park Grand London Kensington, Wifi was very poor had to go down to the lobby to get a signal and even there it was not very good   Great location The room was small but very liveable nice design made the most of a small space ,8.4
Park Grand London Kensington, Didn t like the basement room I was given No windows no natural light although I made a request for a high room on my reservation Rooms 1 20 are in the basement   Very modern room with updated bathroom and electrical plugins Very close to Earls Court underground ,8.4
Park Grand London Kensington,  Very nice staff nice room the only baad thing was the skylight because early in the morning you are woken up because they have not sorted the blind out Otherwise excellent room and bathroom would stay again,8.4
Park Grand London Kensington, Traveling with our teenager the room for 3 was small and windows on 2 walls nice for light but the view was other buildings We weren t in the room much so it wasn t a big problem   Location very convenient to Underground and restaurants Electric kettle with tea and biscuits was nice touch ,8.4
Park Grand London Kensington,  Staff at the Park Grand Kensington are excellent They greeted us warmly checked in quickly and helped us to our room making sure our immediate needs were met ,8.4
Park Grand London Kensington, Room 001 was behind the kitchen lots of stairs to get to it and very small On the pavement so heard everything including the porters conversation Bed was uncomfortable and a small double We witnessed Ladies of the night at reception they stayed with a guest at the hotel Wifi poor strength   Close to Earl s Court tube station Modern and clean Tea Coffee facilities microwave and hairdryer supplied ,8.4
Park Grand London Kensington, Bathroom very small and uncomfortable Could hear the near room doors opening and closing all the time No soft close   Very helpful and friendly staff Hotel was clean ,8.4
Park Grand London Kensington, Just a bit of a musty smell  lovely staff kindly upgraded me to a suite but it was lower ground and did smell a little musty however it was very clean ,8.4
Park Grand London Kensington, I didn t want to leave  Loved the location 100m from Earl s court station Nice bar area Few restaurants behind hotel in a quaint little street Good pub in street behind hotel Modern rooms Loved it ,8.4
Park Grand London Kensington, I didn t like that the room was in the basement and didn t have a window I was not warned about it in advance and when I requested a room change they couldn t change it   I liked the staff they where very helpful and professional ,8.4
Park Grand London Kensington, Queue for breakfast was a bit much Small dining room so I understand why Selection for breakfast was small but what was there was lovely   Great location a two minute walk from the tube station Lovely restaurants around hotel also Staff lovely and room was very spacious for a London city hotel Loved it Staff were lovely and there are some lovely guys at the door who will carry your bag up and down the steps Also it was spotless ,8.4
Park Grand London Kensington, The phones in the room didn t work and the night time food offerings were not great If you have any mobility issues ask for an accessible room getting in and out of the tub is dangerous for anyone who is not in very good shape   This is a great location and extremely clean for London The room is small but comfortable They day staff were extremely helpful and friendly ,8.4
Park Grand London Kensington, The towels were clean it frayed and thin we had to wait for over 20 mins to check in as there was only one person on the desk and those checking in before us had queries and complaints Bacon oddly sweet scrambled eggs like they were powdered   Staff were clearly trying to be pleasant and helpful The location is v good for the museums the hotel is bright and modern ,8.4
Park Grand London Kensington, Hygine condition is extremely awful and hopeless We found human hair and sink flakes on the beds in my room and my parent s room room 001 and 004  good location with 10 mins walking didtance to the imperial college,8.4
Park Grand London Kensington, Rooms are small If they put you in the basement one of the rooms had sort of an empty little place outside the room It was filled with cig butts and some tissues I closed the curtain because it wasn t very pleasing to look at  ,8.4
Park Grand London Kensington, Two hours before my arrival they phoned me to inform that my room was not available and I had to move to another hotel in Marble Arch this was not acceptable with such a short notice so I refused and they assigned me an underground room with a small window on top no natural ligh and no chance to get fresh air into the room  Position of the hotel cleanliness and staff,8.4
Park Grand London Kensington, As returning guests we found that front desk staff need to be a little more responsive I went down to revalidate key card which failed to work The fellow concluded the checking in of a new guest which took like forever as the new guest had issues with payment etc Revalidating the key could have taken a few seconds whilst still attending to the fresh guest Housekeeping staff very obtrusive and impatient as they kept opening the room intermittently ignoring the fact you were indoors and your state of undress They practically forced you out when they wanted to clean Aside from these issues all was well   Location was fantastic room comfortable A little more room space would have been fantastic ,8.4
Park Grand London Kensington, I feel really sorry to say that the hotel staff is not very friendly I only want to ask them a favor to keep a small thing in the reception desk for one night for my friend to pick it up when I am out of London but they did not accept it They are not willing to help people at all  ,8.4
Park Grand London Kensington, Room noisy Corridors narrow and complicated   Staff Excellent Location Value Restaurant,8.4
Park Grand London Kensington, no comment  very friendly staff from reception throughout very attentive and helpful we had a triple room which was excellent and roomy,8.4
Park Grand London Kensington, Mattress could be less soft   the second room we were offered,8.4
Park Grand London Kensington,  It was clean and tidy Comfortable bed Clean linen and towels both evenings ,8.4
Park Grand London Kensington, The tv wasn t working all night  The bathroom,8.4
Park Grand London Kensington, Bed very soft  Helpful staff ,8.4
Park Grand London Kensington, House keeping needs improvement  Very freindly staff,8.4
Park Grand London Kensington, People smoking in other rooms   Quiet,8.4
Park Grand London Kensington, nothing  great location,8.4
Park Grand London Kensington, All was good  We didn t visit any local restaurants,8.4
Park Grand London Kensington,  The location The price and the helpful staff,8.4
Park Grand London Kensington, Our room was located in the basement so no view   Staff were extremely friendly and helpful and the hotel and surrounding area felt special,8.4
Park Grand London Kensington,  Coffee when we left,8.4
Park Grand London Kensington,  Everyone was extremely nice and the location was great Definitely a hotel to stay at next time I go to London ,8.4
Park Grand London Kensington, Nothing really apart from the room was a little small but I am not criticising  The added extras and staff,8.4
Park Grand London Kensington,  Great location Nice staff,8.4
Park Grand London Kensington, The quilt was too small not filling the quilt cover   Friendly and extremely efficient staff ,8.4
Park Grand London Kensington,  From check in to check out the staff were amazingly helpful plus free chocolates on reception was a bonus Slept like a log in the comfy bed,8.4
Park Grand London Kensington, The hotel lay out is very confusing Maybe a map would be helpful  ,8.4
Park Grand London Kensington, Breakfast  Food,8.4
Park Grand London Kensington, My room was in the basement no window and natural light Not a good deal indeed   Good location ,8.4
Park Grand London Kensington, Nothing  The staff couldn t be more helpful Would have no issue recommending to stay in the hotel,8.4
Park Grand London Kensington,  Too much bad everything,8.4
Park Grand London Kensington, Bigger bathroom with a bath   Overall professional attitude of the staff especially Kaniska who was brilliant,8.4
Park Grand London Kensington,  The staff was very warm and helpful great location and our room was very comfortable and spacious even though we triple shared it ,8.4
Park Grand London Kensington, Room is too small not a good one especially we have big and many luggages   Good location to the earl court tube station Lift is available ,8.4
Park Grand London Kensington, Extremely poor customer service One has to be extremely careful with his possessions on this property  ,8.4
Park Grand London Kensington, The rooms could be brighter   Very clean bathrooms Staff very friendly and helpful Ideal location for the tube ,8.4
Park Grand London Kensington,  Very good location and excellent staff,8.4
Park Grand London Kensington, Nothing everything was good  A total surprise It was my birthday and the staff put balloons chocolates and wine in my room A lovely touch ,8.4
Park Grand London Kensington, Given a room with NO window down in the basement porters clothes were creased  Mirror in the Bathroom,8.4
Park Grand London Kensington, Rooms overlooking road can be noisy  Clean comfortable rooms Friendly staff Free mobile phone ,8.4
Park Grand London Kensington, Basement room  Location,8.4
Park Grand London Kensington, Room light switches a little complicated ,8.4
Park Grand London Kensington, nothing  always stay at this hotel ,8.4
Park Grand London Kensington, Everything poor  Poor,8.4
Park Grand London Kensington, A little nitpicky but not much room to put any personal toiletries in the bathroom   Nice Staff Comfortable room and bed ,8.4
Park Grand London Kensington,  Everything,8.4
Park Grand London Kensington,  Bed was so comfy and great staff Loved the noon check out ,8.4
Park Grand London Kensington,  The room was really hard to find I got lost almost every time And it was really noisy at night ,8.4
Park Grand London Kensington, Clean high standard excellent hotel  Excellent location,8.4
Park Grand London Kensington, The lift didn t work so we had walk 6 floors everyday  ,8.4
Park Grand London Kensington, Double bed a bit small  The staff were great when my husband was unwell bring up chilled bottles of water and checking he was okay ,8.4
Park Grand London Kensington, room was down 2 flights of steps  A C in room bag storage service after check out,8.4
Park Grand London Kensington,  Nice location close to the Earls court hub and Kensington gardens,8.4
Park Grand London Kensington,  Very warm environment central location would recommend Vanessa for all of her support during my stay,8.4
Park Grand London Kensington,  Very friendly staff warm environment Would like to especially recommend Vanessa for her very valuable assistance throughout my stay ,8.4
Park Grand London Kensington,  The Handy phone was an extremely useful benefit,8.4
Park Grand London Kensington,  Very comfortable stay will use again,8.4
Park Grand London Kensington, Cramped bedroom  Friendly staff,8.4
Park Grand London Kensington, N a  All good,8.4
Park Grand London Kensington,  The staff is amazing very caring and helpful The hotel is located very close to Earls Court which provides access to various tube lines ,8.4
Park Grand London Kensington,  Nice and clean ,8.4
Park Grand London Kensington, see above  The room itself was nice but quite small with no natural light no window ,8.4
Park Grand London Kensington, small room  Concergie and reception very very kind people,8.4
Park Grand London Kensington, Nothing   Chocolates and card given by the staff,8.4
Park Grand London Kensington, The lobby was small and not cozy  The hotel offered a great breakfast buffet The staff was very helpful Our room was comfortable and clean ,8.4
Park Grand London Kensington, Club room was a lot smaller than expected   Excellent location,8.4
Park Grand London Kensington, reception area was very cold   location Close to tube Breakfast good ,8.4
Park Grand London Kensington,  Great view,8.4
Park Grand London Kensington, Absolutely no view as we were in a basement room but it was quiet   Modern clean quiet and great staff,8.4
Park Grand London Kensington,  Fine location wide rooms,8.4
Park Grand London Kensington,  The staff are fantastic so welcoming and are happy to help with everything,8.4
Park Grand London Kensington,  Modern and clean,8.4
Park Grand London Kensington, Very small room  Helpful staff and good location,8.4
Park Grand London Kensington, Only one night not enough to state dislikes  Very neat and staff very helpful and friendly Good breakfast ,8.4
Park Grand London Kensington, price of breakfast we decided to go out  under floor heating in bathroom and for a big hotel it was so quiet,8.4
Park Grand London Kensington,  great staff very clean and good price ,8.4
Park Grand London Kensington,  Staff were really helpful and friendly The room was very comfortable ,8.4
Park Grand London Kensington,  Excellent service fantastic location friendly staff Can t complain ,8.4
Park Grand London Kensington, didn t really like that the room was in the basement  Apples were great The bed too and the staff was superb,8.4
Park Grand London Kensington,  The room was lovely and clean Staff were very friendly Location is fantastic ,8.4
Park Grand London Kensington, Nothing really  Great hotel clean and lovely stuff Very good location and breakfast was delicious ,8.4
Park Grand London Kensington,  Staff went above and beyond our expectations,8.4
Park Grand London Kensington,  Excellent value for money ,8.4
Park Grand London Kensington,  Great Hotel great value fro money The stuff is friendly Close to tube station Earls Court ,8.4
Park Grand London Kensington,  Super friendly reception also breakfast dinner staff breakfast for UK really eatable ,8.4
Park Grand London Kensington,  Staff r excellent and coooerative like Ajaz and others,8.4
Park Grand London Kensington, The sink wash basin was blocked in our bathroom and it made it difficult to wash and brush teeth etc   Staff were very helpful and friendly,8.4
Park Grand London Kensington, club room is a joke a broom cupboard is more like it total waste of money very amateur staff huge discrepancy between web and reality   location,8.4
Park Grand London Kensington, Food was poor pasta with tiger prawns was awful about 2 prawns cut up into horrible slices and tough to chew ,8.4
Park Grand London Kensington,  easy to get to ,8.4
Park Grand London Kensington, Nothing  The welcoming staff and excellent location,8.4
Park Grand London Kensington, Noise in room from above ceiling external extractor noise  Very good breakfast,8.4
Park Grand London Kensington,  The staff are very friendly and helpful Specially the night shift manager Aijaz ,8.4
Park Grand London Kensington,  Bed was so comfy And both days the room was cleaned ,8.4
Park Grand London Kensington, All good  Staff location,8.4
Park Grand London Kensington,  Great bathroom ,8.4
Park Grand London Kensington, The noise at the last floor air conditionned   Breakfast Staff,8.4
Park Grand London Kensington, the rooms were very small ,8.4
Park Grand London Kensington, Occasionally noise  Care to their guests,8.4
Park Grand London Kensington, The rooms were a bit small for the price we paid It was kinda expensive   The location was good Easy access from Heathrow airport by train ,8.4
Park Grand London Kensington,  Very friendly staff who went above and beyond to make our stay special,8.4
Park Grand London Kensington,  The staff are so welcoming everytime I have stayed so happy with the service all in all,8.4
Park Grand London Kensington,  staff were very friendly and efficient everything was done to make our stay as stressfree aspossible,8.4
Park Grand London Kensington, All good  Happy,8.4
Park Grand London Kensington,  The staff were really helpful ,8.4
Park Grand London Kensington, Nothing  The beds were extra comfy and there was delicious fruit in the rooms,8.4
Park Grand London Kensington, N a  The stuff and service was by far the best thing couldn t fault it Especially the French guy not sure of his name but he was amazing,8.4
Park Grand London Kensington, Staff ,8.4
Park Grand London Kensington, Nothing I was aware of   Assistance whenever needed I am disabled ,8.4
Park Grand London Kensington,  loved the chandelier in the foyer,8.4
Park Grand London Kensington, ,8.4
Park Grand London Kensington, Nothing  Staff are so helpful smile and always ready for Clint,8.4
Park Grand London Kensington, The view from our room wasn t great but it is in a built up area   The room was spacious and it was quiet,8.4
Park Grand London Kensington, language barrier at reception ,8.4
Park Grand London Kensington,  Great room really comfy nice touches with fruit etc Modem and luxury feel Amazing service ,8.4
Park Grand London Kensington,  The shower,8.4
Park Grand London Kensington, Very small room  Location,8.4
Park Grand London Kensington, The problem with the booking and their cancellation fees Also the lift was very slow   Very handy location close to transport And restaurants ,8.4
Park Grand London Kensington, Bigger room  We had to be moved to their Earl s Court hotel but apart from this minor inconvenience it was all very well handled ,8.4
Park Grand London Kensington, The pillows were really poor just foam and very uncomfortable unusual for a 4 star property   Close to Earl s Court tube good breakfast,8.4
Park Grand London Kensington,  Great staff Comfortable bed ,8.4
Park Grand London Kensington, Nothing  Comfortable friendly environment suited our needs perfectly,8.4
Park Grand London Kensington, Wanted to give us a room underground No way  ,8.4
Park Grand London Kensington, We turned thermostat as low as possible but room still very hot   Excellent location Very clean ,8.4
Park Grand London Kensington, Fruit and water only on arrival despite booking and extending every day for 3 days   Modern good quality and good location ,8.4
Park Grand London Kensington, Nothing  Everything,8.4
Park Grand London Kensington, Rooms quite small Only one slow lift Bureaucratic systems   Location quiet street,8.4
Park Grand London Kensington,  Friendly reception staff helpful chef and waiting staff comfy bedswould definitely stay again ,8.4
Park Grand London Kensington, Room small upgraded to a club room and there was no bath and a tiny bathroom  Staff were pleasant,8.4
Park Grand London Kensington,  Amazing hotel couldn t fault very helpful staff ,8.4
Park Grand London Kensington, Smallish room and restaurant was weak for meals other than breakfast   The staff and service ,8.4
Park Grand London Kensington, Check in was slow and the room was incredibly small as was the shower room   Great location ,8.4
Park Grand London Kensington, Nothing   Rooms extremely comfortable scrupulously clean Staff courteous and helpful Can t wait to go back ,8.4
Park Grand London Kensington, View from our room was looking onto the street  The bed was incredibly comfortable,8.4
Park Grand London Kensington, Nothing   Much friendly staff they are really professional Room is clean and warm enough Location is nice really close to tube station ,8.4
Park Grand London Kensington, poor cummunication  The room was the smallest room I have ever stayed in,8.4
Park Grand London Kensington,  The staff were very attentive underground was just a short walk would definitely stay again ,8.4
Park Grand London Kensington,  The level of customer service was impeccable from reception staff to doorman Nothing was too much trouble ,8.4
Park Grand London Kensington, Nothing   Liked the location everything you need in walking distance ,8.4
Park Grand London Kensington, bed was a bit soft  room was clean bathroom was lovely lift access with suitcases,8.4
Park Grand London Kensington, nothing really   Very attentive and helpful staff,8.4
Park Grand London Kensington, Room is too small  Area,8.4
Park Grand London Kensington,  Clean friendly and lovely room ,8.4
Park Grand London Kensington, I asked them to book me at higher floor and i had a room at lower basement   The hotel s location,8.4
Park Grand London Kensington, view from room   lovely breakfast clean modern rooms friendly staff,8.4
Park Grand London Kensington,  Best full English I ve ever had,8.4
Park Grand London Kensington, Room was really really small  Superbly clean with very friendly staff,8.4
Park Grand London Kensington, We enjoyed everything about the hotel  Didn t eat breakfast at the hotel,8.4
Park Grand London Kensington, Window didn t stay open and despite asking for a room with a nice view got a room overlooking the bins  ,8.4
Park Grand London Kensington,  Always good to be back here Comfortable stay clean rooms great location very friendly and helpful staff Wifi works very well and fast too ,8.4
Park Grand London Kensington, No window  Comfortable bed,8.4
Park Grand London Kensington, Rooms adequate but small  Location to Kensington high st and South Kensington Near a tube station,8.4
Park Grand London Kensington, All fantastic  Everything was perfect,8.4
Park Grand London Kensington,  Everything was excellent the room the staff the location I would recommend this hotel to friends and family,8.4
Park Grand London Kensington, Size of room  Disappointed with the size of the room for the money you pay,8.4
Park Grand London Kensington, Staff incapable of booking a taxi and then when they did the driver had no idea where he was going   Comfortable room Good location ,8.4
Park Grand London Kensington, Nothing  Beds very comfortable Staff friendly approachable and diligent ,8.4
Park Grand London Kensington, nothing  good location for the museums nice breakfast room and breakfast room available from early,8.4
Park Grand London Kensington, Quite small room and bathroom  Comfy bed good location,8.4
Park Grand London Kensington, The room was rather small   Very good breakfast Very comfortable bed ,8.4
Park Grand London Kensington, Rooms far two small as a double ,8.4
Park Grand London Kensington,  It would be great if the had Gluten Free options and vegetarian sausages,8.4
Park Grand London Kensington, Lack of window in basement room  Friendly staff and bottle of wine given as birthday treat,8.4
Park Grand London Kensington, Nothing  LocTion Room size staff,8.4
