Hotel_Name,Full_Review,Average_Score
Strand Palace Hotel, All good apart from the kettle in the room had tea leaves in it and hadn t been cleaned The Dawaat restaurant in the hotel served very tiny portions   The breakfast was a good selection Concierge staff very helpful and knowledgable about London Excellent location with staff who were always polite and willing to help ,8.1
Strand Palace Hotel, Nothing   Only stayed one night Everything was purfect as usual We were upgraded to a standard double The breakfast was excellent Friendly helpful staff ,8.1
Strand Palace Hotel, Very small rooms without air con are VERY hot Lots of road noise if you open the windows to try and cool down Disappointing aspect   Good location good breakfast ,8.1
Strand Palace Hotel, We cannot give full marks for everything as we are never in the hotel for long enough We have never chosen to eat breakfast or an evening meal in the hotel Choosing an upgrade for a room has worked for us a bit extra space I would prefer a feather pillow but for one night everything is fine   We choose The Strand Palace because of its location The staff are friendly and informative We only ever stay overnight ,8.1
Strand Palace Hotel, It might have been better for my nerves not to have had the fire alarm sounding at 9 00 in the evening for a false alarm but better safe than sorry   The attitude of the staff nothing was ever too much trouble Spotlessly clean and comfortable ,8.1
Strand Palace Hotel, Very poor customer service at reception I reached there at midnight wanting some rest Staff took some half an hour to go through checks and booking in Such a poor service honestly I dislike from my heart   Location was good ,8.1
Strand Palace Hotel, I didn t appreciate the fire alarm going off at 9pm This is the second time this has happened at this hotel Someone smoking in the bedroom With computer systems these days they should be able to tell which room is the problem instead of evacuating the whole hotel Never had this happen before anywhere else   Location location it is perfect for the galleries and theatres I want to visit ,8.1
Strand Palace Hotel, Lack of air conditioning In a 4 star hotel it should be a given If premier Inn can have it why can t you In this day and age it s a must   Great location for the theatres and London city Facilities were great and so was the food and cocktails,8.1
Strand Palace Hotel, Service at breakfast was slightly slow no fridge in the bedroom had to discuss advertised discount on food and drinks at check out although it was granted in the end  Comfortable large bedroom warm welcome good bars,8.1
Strand Palace Hotel, I cannot work out what the doormen are for They can be replaced by a small wooden wedge or an auto door One of them spends his time yelling at the staff   Everything We always stay here when in London Raymond the concierge is the greatest ,8.1
Strand Palace Hotel, It was a hot weekend so air conditioning would have been good although there was a fan in the room which was a bonus and helped   The location could t have been any better,8.1
Strand Palace Hotel, The bed is quite small for two people   Very very good location so convenient to the monuments But the area has many homeless around quite smelty The bed is quite small for two people The breakfast is so great typical English breakfast and many choices included ,8.1
Strand Palace Hotel, There was nothing l didn t like   The rooms were very comfortable The reception staff were very efficient The hotel was in a very convenient location ,8.1
Strand Palace Hotel, Staff were clearly over stretched and a little rushed and impatient   I liked the bath robes and slippers the little extras and the excellent level of cleanliness,8.1
Strand Palace Hotel, Nothing Our most recent stay was excellent   This hotel is conveniently located in central London It is easy to walk to all the major central London tourist hot spots Underground stations are within a short walk and bus stops are adjacent to the hotel Staff are friendly polite and helpful The hotel is always spotlessly clean Rooms are well appointed and have everything you need for a stay in London ,8.1
Strand Palace Hotel, Single rooms tend to be small and with no view I understand the reason for this lack of space in central London Very high price   Efficient and very pleasant reception staff clean modern room comfortable bed good and varied breakfast Always nice to stay in this hotel I like the atmosphere and it is a great location for sightseeing shopping and theatres in London ,8.1
Strand Palace Hotel, No air conditioning on what was a very hot August weekend quite stuffy as a result The lifts took ages to come only one ever seemed to be in use at a time despite there being three of them   Fantastic location a few minutes walk from many top London points of interest Very friendly and professional service Free computer printer for tickets boarding pass many hotels charge for this so this was a good plus point ,8.1
Strand Palace Hotel, The room It was more like a student room on a university campus than a hotel room No curtains but wooden shutters not solid period ones bed pushed against the wall as this was the only way a double would fit in no air conditioning generally other hotels locally represent better value for money and much better comfort   Location only,8.1
Strand Palace Hotel, Wasn t impressed with the breakfast over priced and bacon hard and chewy croissants hard and taste horrible this is the only thing that let the hotel dwn everything else was great  Check in fast and friendly all staff friendly when in and around hotel room lovely comfy clean and quite,8.1
Strand Palace Hotel, The perfectness of London is also the downside no need for hotels to even have the ambition to stand out and make an effort room too hot too old bed too small I had a double with my daughter bed was 180cm I am 186cm and 120cm wide and the view of room 892 was just redicoulous way overpriced   London is fantastic Strand next to Covent Garden is the perfect location for my daughter who visited the city for the first time and me as a London resident for many years ,8.1
Strand Palace Hotel, No air conditioning in standard rooms be warned if visiting in hot weather Room a little on the small side  Great service and location Good mix of facilities available,8.1
Strand Palace Hotel, Room size with ref to bed position which was up against the wall at one side Should have booked a larger room I think Will do so next time   All likes already stated,8.1
Strand Palace Hotel, The bathroom was poorly equipped and too small The shower flooded the room in spite of correctly using the curtain in the bath Pillows very uncomfortable   Location,8.1
Strand Palace Hotel, I would have loved a small fridge in the room   The staff were welcoming and friendly I needed help with printing out an email that I should have brought from home Reception were happy to print it for me which was a great relief ,8.1
Strand Palace Hotel,  My husband and I thoroughly enjoyed our stay at the Strand Palace It was our first stay there Everything about the hotel was lovely The choice of breakfast was superb displayed and we l organised We enjoyed the comfort of the lounge for coffee and a cake away from the hustle and bustle of Covent Garden The location was ideal a short walk to Joe Allens for evening meal and a drink in the cocktail bar next door first We are looking forward to our next stay ,8.1
Strand Palace Hotel, I got very bad reception people who was not friendly to treat me when I asked a coulp of hours check out They can changed price dramatically and the attitude was very bad Sorry have such kind of memories in this hotel since I am the one ofenly travring around word   The people who worked Conciege and house Maid ,8.1
Strand Palace Hotel, The room could have been a bit larger but this is Central London   so convenient for the theatre right in the centre of things Room a little small but had all the facilities we needed Breakfast was good ,8.1
Strand Palace Hotel, Bed pillows were very hard the sink was cracked water did not empty from sink very well TV control was not working right some staff did not understand English very well Got different answers from different staff concierge did not have enough information to help you I booked it as a 4 but would only class it as a 3 was quite disappointed Would not recommend it as a 4 to friends   Breakfast was nice good area ,8.1
Strand Palace Hotel, whilst the cleaning staff were v friendly the rooms could do with a good scrub especially the bathroom and taps etc with the Strand Palace you are definitely paying for location as the hotel is expensive for what you get I found one of the concierge and one doorman quite rude to guests  ,8.1
Strand Palace Hotel, The room It was described as a cosy room A better description would be a sauna Very hot even with the window open and a fan on   Staff very friendly and helpful Location excellent,8.1
Strand Palace Hotel, Could find nothing I didnt like was truly impressed and pleased with the whole weekend experience  Tmy toom was a single and having feared it would be like a box i was pleasantly surprised the room was spacious as was the adjoining bathroom My friends shared a cosy room and likewise pleasantly surprised and pleased at the space I cannot fault this hoyel and the location was the best for all tourist lications we walked everywhere ,8.1
Strand Palace Hotel, Rooms furniture is quite old and no air conditioning in the rooms and quite loud noise combing through the windows even though they are closed  Friendly staff and great location,8.1
Strand Palace Hotel, paying for ice come on what is that all about just add 1 to every room and make it free Had to troop down to the concierge get him to make change troop back up to 6th floor etc   Good location comfortable hotel tried to help when we arrived to check in early but room not ready got changed in the gym ,8.1
Strand Palace Hotel, The hotel was very noisy in the morning not the fault of the hotel probably more other guests   The location is right in the heart of London My room was ready when I arrived at 10 30 am even though it said check in was from 2 pm and I had been upgraded from a cosy single to a standard single at no extra cost The hotel was far more glamorous than the website suggests,8.1
Strand Palace Hotel, Slow check in Extremely small room though it was an economy single so I didn t expect it to be large Windows hard to open   Great location handy for theatres Covent Garden restaurants easy to get to the South Bank Tate Modern and Shakespeare s Globe good breakfast staff generally friendly and helpful Nice new bathroom ,8.1
Strand Palace Hotel,  Staff are extremely welcoming and professional Really made you think you d want to return in the future Fantastic location Covent Garden theatreland and Soho on the doorstep Excellent public transport links buses outside the dor tube five minutes walk ,8.1
Strand Palace Hotel, Queueing for breakfast Staff in breakfast room a little lacking manners when you are carrying your food to table Although food good bacon very overcooked   Convenient location helpful and attentive staff and suitable overnight hotel for central London visit Lovely hotel ,8.1
Strand Palace Hotel, The hotel has been refurbished and I feel a bit sorry that no air conditioning has been installed in the rooms especially because the windows can only be opened a little   I liked everything and breakfast is simply super As I am a theaterbuff the location of the hotel is super Buses and tube are within easy reach and many City highlights are within walking distance Staff are very friendly I stayed at the hotel at least 7 times and I hope to be back soon ,8.1
Strand Palace Hotel, The bed was rather too firm for me   The room space had been well thought out for a budget room The breakfasts were excellent Apart from an occasional plumbing noise the soundproofing was good ,8.1
Strand Palace Hotel,  The staff were extremely polite friendly and helpful The room was spotless and the huge bed was very comfortable There was a great variety of food for breakfast and it was all well cooked and attractively presented We can also recommend The Carvery both for quality of food and value for money We particularly appreciated the way we could leave our luggage with the concierge after we had checked out so that we didn t have to lug it around London for the rest of the day ,8.1
Strand Palace Hotel, I had unfortunately used Booking com and made a slight error When I called the hotel one member of staff said I would definitely need to contact Booking com again I tried but could not get a response from them so I called the hotel again and another member of staff told me she could make the amendment after all I was grateful that the second member of staff knew what she was doing Next time I shall book directly with the hotel as they give you incentives when you book through them   My room was changed to a quieter part of the hotel as last time I stayed I was woken up very early by bottles being emptied also this time I did not have an adjoining room which was great as you can hear everything through the walls So I finally got the peace and quiet I deserved ,8.1
Strand Palace Hotel,  My room was billed as cosy which meant very very small but it met my needs as a single traveler and the value was very good considering that this is a full service hotel on The Strand in walking distance to theaters museums and many shops and restaurants ,8.1
Strand Palace Hotel, The parsnips on the carvery were partially burnt My room did not have air conditioning although they did give me a fan When I book through your site I usually get an ordinary room This time I got a single which was rather small although the bathroom was very nice   The hotel location suited my activities I could use the bus across the road to get to most places I wanted The staff were also very pleasant Breakfast was good ,8.1
Strand Palace Hotel, Rooms adequate in size but beware of lowest price level as rooms are tiny If that is what your budget allows then price is very reasonable for city centre  Perfect location for all London attractions and priced fairly for such a central location,8.1
Strand Palace Hotel,  very happy and surprised when checking in that we had been upgraded and a request made by a family member to the hotel was met they more than fulfilled the ask A very happy newly engaged couple,8.1
Strand Palace Hotel, The place is overpriced for the type of room you get If you are single you are better off in a hostel You will get a better accommodation there The rooms have no air conditioning and are closed off from air making it very hot in the rooms and uncomfortable The beds are saggy and are worse than some hostels Not what I would expect from a so called 3 or 4 star hotel I would avoid this place  Good Location,8.1
Strand Palace Hotel, Room on the Strand road side and having stayed before this was the first time we stayed on the road won t do it again at night you can really hear the traffic and did affect getting to sleep  Location fantastic for getting around,8.1
Strand Palace Hotel,  Great location for walking around the centre of London and close to Trafalgar Square Handy for museums theatres and shops I ll use it again next time I m in London ,8.1
Strand Palace Hotel, Very noisy cleaners early in the morning and kept trying to get into the room Maybe update cleaners on who has and hasn t checked out   clean comfortable and value for money,8.1
Strand Palace Hotel, The room was tiny no air conditioning so very warm through the night Everything was in the way of the plugs A double bed but against a wall not easy to get in and out off They call it the Cosy Double don t be fooled cosy tiny   The location was good ,8.1
Strand Palace Hotel, Room either too hot or too noisy It overlooked the inside area which had some very noisy fans running 24h With closed windows the room was too hot Impossible to get a good night s sleep  ,8.1
Strand Palace Hotel, not even small refridgerator small windows not allowing the air to circulate not clear information about the services in the hotel booklet long time to wait for a lift  great location,8.1
Strand Palace Hotel,  Great staff at breakfast and a wide selection of foods Also the hotel gave my husband and I a Happy Birthday muffin which was in the room for us ,8.1
Strand Palace Hotel, Rooms a bit small for the price we paid but well appointed I guess if you had masses of luggage it could be a problem This wasn t an issue for us as we were over nighters   it is a very comfortable hotel with bars and restaurants within striding distance The hotel facilities are superb if you are feeling to lazy to go out Location is great,8.1
Strand Palace Hotel, The WiFi never worked in my room   The location and cleanliness I was upgraded to a double room from the single room I had booked so making it good value for the centre of London ,8.1
Strand Palace Hotel, Very uncomfortable and stiflingly hot I contemplated sleeping in the lobby as it seemed to be the only place that had air conditioning Not worth a fraction of the price it commands   Very close to Covent Garden,8.1
Strand Palace Hotel, Room and bathroom too small The cost didn t justify what was probably the smallest bathroom I have ever seen in a hotel Other people I spoke to in the bar said the same so it wasn t just our room   Location,8.1
Strand Palace Hotel, In order to check in two hours early to our cleaned and ready room the front desk required a 20 pound fee Perhaps worth it but we skipped the option and went to have lunch There s no fee to have them hold your luggage   The breakfast buffet offered a convenient tasty option that was a really good buy The fitness room in the hotel was adequate to provide a good workout in a pleasant setting The hotel is a terrific buy in terms of its good amenities and the excellent location ,8.1
Strand Palace Hotel, Ridiculously small room even for London no A C bit too expensive for what you get  Location cleanliness housekeeping staff check in and check out Luggage storage after check out,8.1
Strand Palace Hotel, Asked for room to be decorated for birthday Was told it could be possible Asked what time we would be out On our return nothing had been done   Had a gift of breakfast in bed but the pastries were very dry Bed not big enough for a 6 foot plus male ,8.1
Strand Palace Hotel, Not being able to open windows very hot in bedroom bathroom  We have stayed here before great location and staff mostly helpful Lady on check in was really helpful as we had a few rooms and she helped sort our booking out Thank you again and we look forward to returning ,8.1
Strand Palace Hotel, Room not ready when arrived Second morning breakfast delayed by lack of staff We booked an executive room and felt it wasn t value for money   Location is Excellent Cleanliness is excellent ,8.1
Strand Palace Hotel, The room was absolutely airless to the point of stifling although I had an extre night booked I decided to leave one night early as I couldn t stand another night of roasting in hell I had a single room one night facing a wall so changed to a double not much bigger still facing a wall and like an oven Also they were very unbending about changing one night s accommodation for me to another although in money terms it wouldn t have changed anything for them and the room was available it would have made another loyal customer for them it is not great to shoot themselves in the foot by some silly rules that can be adjusted in special circumstances Every customer counts and word of mouth is still the best or worst advert The hotel is called grand but in fact it is a very tired hotel and needs an update badly I would be spending my money somewhere else in the future  The staff were nice but scatty two mornings my tea and gluten free bread took over 20 minutes to get to me not great when you need to be at work,8.1
Strand Palace Hotel, small room with very noisy extractor fans from outside our room also the fans generated heat which made our room unbearable to sleep in  location was excellent,8.1
Strand Palace Hotel, the size of the room and bed and that it was againt the wall there was no aircon only a fan which was too noisey   the location the efficiency of the staff,8.1
Strand Palace Hotel, First room was noisy but then I was moved to another one which was perfect   Nice food cosy room excelente location really close to Covent Garden and Trafalgar Square Served by Picadilly Line excelent if you re arriving from Heathrow Airport ,8.1
Strand Palace Hotel, Breakfast was good but not great Like many London hotels very busy and they struggle at times to deal with the numbers at reception and in the restaurant   Great location Easy walk to Trafalgar Square or Theatres Lots of restaurants around Had an executive room which was a good size quiet and comfortable This is our second stay and equally as good ,8.1
Strand Palace Hotel, There was a heat wave in London and the rooms were not air conditioned It was hard to sleep and impossible to rest in the room We had to hang in the lobby to stay cool The rooms were also very small for twin rooms   I liked the service and I liked the facilities the lobby the restaurant the concierge etc The location was perfect for us ,8.1
Strand Palace Hotel, Everything was fine echo the view from the window but that could be changed Perhaps air conditioning could be installed but a fan was provided  Room was spacious and well equipped and very quiet,8.1
Strand Palace Hotel, Rooms were far to small described as COZY small should be the word not cozy Bath rooms dated as well So for the money I won t be staying again   location,8.1
Strand Palace Hotel, We went for an executive suite However this was just a normal room by all accounts Fabulously big bed but some furnishings looking a bit tired and the bathroom was tiny Also for an executive suite the room itself was actually quite small   The location is fabulous very close to Covent Garden and the theatres Easy to get to and great customer service by all the staff who served us Lots of facilities available too The breakfast which came with the Executive Room was very good indeed ,8.1
Strand Palace Hotel, For cost would have hoped to have air con in the room A fan was provided but not sufficient to keep the room cool without the window open which meant street noise Bed small and uncomfortable   Super location close to tube and local attractions Good restaurants close by Well presented room ,8.1
Strand Palace Hotel, Not a major problem but there was a bit of a wait at reception when checking in and out Another member of staff to receive guests would have been welcome   Clean good facilities pleasant helpful staff good food good location ,8.1
Strand Palace Hotel, Air conditioning in room We were there during a heat wave   Location was perfect was right in the middle of everything Walking distance to all places of interest ,8.1
Strand Palace Hotel, Queuing up for breakfast or being guided to a makeshift breakfast space is no fun  The perfect location Walkable to all the main sites shopping and right across the best musicals in town,8.1
Strand Palace Hotel, Bathroom very compact shower over bath awkward and not that easy to control water direction Toilet in bathroom needed fixing during our stay poor flush Room very hot   The location near theatres Covent garden is excellent Concierge staff were especially pleasant helpful Very good breakfast Cleanliness A Would stay again if visiting London ,8.1
Strand Palace Hotel, Do not rely on the pictures as a guide as the rooms are smaller than pictured Not great value for money in terms of the room but we were not in it that often so it didn t affect us too much   Great central location Very clean and upmarket lobby area and bar restauraunt area ,8.1
Strand Palace Hotel, This older property only has air conditioning in the lobby so in summer and warmer days of spring you ll be using the provided oscillating fan and an open window to cool off There is a heating radiator for winter I think my son was a little disappointed that the rooms were rather Spartan compared to the sparkling lobby but a hotel should never be the reason for your travel   Hotel location is terrific and central Covent Garden for seeing London near bridges museums The Eye theatre so much within walking distance and the rest a short cab ride or tube ride away The rooms are clean and well taken care of for an older property Beds are okay ,8.1
Strand Palace Hotel, Old fashioned rooms and no air conditioning  Great facilities and breakfast was excellent Female staff member in gin palace was great and dealt with some difficult customers very well ,8.1
Strand Palace Hotel, Lower price of the breakfast would have made this perfect or possibly some discount to breakfast places nearby   The gentlemen at the front doors I just love them created a real British feeling and made us so happy and appreciated quests Also the lobby is nice and peaceful a real contrast to one who steps in from the Strand ,8.1
Strand Palace Hotel, Room wasn t ready when we turned up to check in and they didn t seem to have a clue why and we waited for an hour to get the room key   Location spot on,8.1
