Hotel_Name,Full_Review,Average_Score
Strand Palace Hotel, Shower was broken and dripped all night disturbing our sleep Walls were thin so we were women by the thrashing around of the cleaning staff in the next room at 8am No air conditioning No fridge or mini bar No ice bucket It was the most sparse hotel room I ve been in ever I would never recommend   Location Period ,8.1
Strand Palace Hotel, Having to wait round for check in twice only to be told they couldn t issue us with keys until later on in the evening as computers down Disappointed considering the prob we paid   Very clean and location very good ,8.1
Strand Palace Hotel, Rubbish view from bedroom window  Significant reduction on single rooms Rooms often ready from early in the morning Cases stored after checkout ,8.1
Strand Palace Hotel, Small room with very uncomfortable bed and pillows Very poor wifi signal the only way I could do things on my phone was to turn the free wifi off and use 4g   Location,8.1
Strand Palace Hotel, Description was cosy double room Should have said tiny double room Too expensive for what it was Second time we have stayed here Would not book this hotel again  ,8.1
Strand Palace Hotel, nothing really only that we had a executive room so told to have breakfast in the executive breakfast room Do think there was far more choice in the main breakfast room so would eat in there in future   location was great staff very helpful Executive room very large ,8.1
Strand Palace Hotel, I would have expected a little more to the room for the price Bathroom was clean but looked dated It had a feel of a premier in to the actual room compared to how luxurious the rest of the hotel looks  A great location a short walk from Charing Cross and right around the corner from Covent Garden and some fabulous restaurants,8.1
Strand Palace Hotel,  Excellent customer service and superb location we normally lose too much time using the tube not this time whilst staying here as there is so much within walking distance Room bigger than expected compared to other hotels and the reviews I read on here before staying we had room 706 ,8.1
Strand Palace Hotel, They had trouble finding our double booking on computers when we booked in Be nice if windows were double glazing Very noisy during the night   It was a beautiful room What made it even better is the management put a bottle of wine in my mums room when they were informed it was her birthday Very nice surprise thanks,8.1
Strand Palace Hotel, Initial encounter of staff with particular issue on bookings this actually turned out to be poor communication between Booling com and hotel  Location,8.1
Strand Palace Hotel, Nothing to dislike  Well trained staff efficient but still hospitable Big hotel with atmosphere of a small personal one Breakfast was very good and effectively organised no waiting at any time ,8.1
Strand Palace Hotel, The main door was locked when I arrived at 12pm to check in after a party It took quite a while for me to find someone to let me into the property  Bed is very comfortable Staff are very friendly competent and very helpful ,8.1
Strand Palace Hotel, Had to wait for over an hour to check in Had to leave our luggage with the porter as we had dinner pre booked and checked in later in the evening Worst Customer Service ever experience never even said sorry that we had been through this experience Also if you have already checked in online they dont ever go the the quick check in desk so everyone has to queue up in the same queue   Location,8.1
Strand Palace Hotel, Cosy Room a bit too cosy no room to swing a kitten let alone a cat Promised a view of the Strand below but unable to see street due to wall in front of the window   Pleasant staff god position excellent breakfast able to have something to eat at the bar at 1050pm,8.1
Strand Palace Hotel, When the booking was eventually sorted out we were told that it only included 1 breakfast despite the booking having been made for 2 people We had to pay the extra so that we could have breakfast together The fault for this was it seems with Booking com and i would appreciate your response   There was a problem with the check in but it was handled expertly and with friendliness when our booking didn t show up on their computer ,8.1
Strand Palace Hotel, Room wasn t cleaned on second day at 1500 so housekeeping had to chase up so we had to vacate room while it was cleaned Not enough staff on bars so long waits poor service   Location of hotel Excellent breakfast staff,8.1
Strand Palace Hotel, The room we were given after an upgrade was close to the lifts which did detract from the quietness expected   The location was ideal for visiting central London ,8.1
Strand Palace Hotel, A really small point but the toilet roll holder was under the sink and not convenient for use had to remember to get some paper first Could not see a reason for this but found it just a little odd   The hotel is in a great location for Covent Garden and theatres The room was comfortable and very quiet The staff were helpful ,8.1
Strand Palace Hotel, Although it was meant to be a double room it was actually a single in reality with only one set of towels etc The bed which was hard uncomfortable was flush against the wall so one had to climb out of the foot of the bed during the night if required Never again  ,8.1
Strand Palace Hotel, Restaurant was fully booked we had to eat across the road you would think that guests staying at the hotel would have priority   Great Location for Covent Garden and Adelphi Theatre ,8.1
Strand Palace Hotel, For the price the room was very small could have been a better room but the room was clean and tidy Fresh water each day which I thought was a nice touch   The location comfy bed,8.1
Strand Palace Hotel, Would like more than 2 teabags per 24 hours Also a slightly larger duvet Slight droning engine noise audible from room 460 day and night Some kind of air con unit Windows not double glazed   Friendly and helpful staff Excellent location Relaxing bar comfortable seating ,8.1
Strand Palace Hotel, Cocktails were very expensive   Great location really friendly helpful staff room upgrade for an additional 20 which was worth the extra money Would stay again ,8.1
Strand Palace Hotel, Tiny bathroom Breakfast coffee was serve yourself but no one said where it was Very expensive probably due to the proximity to Xmas beleive it will be 50 cheaper in Jan   Excellent location Good sized bedroom Very friendly efficient reception staff ,8.1
Strand Palace Hotel,  Staff were extremely pleasant and helpful at all times location was great overall it was an excellent stay rooms were imaculate we had breakfast which was worth every penny will definitly recommend,8.1
Strand Palace Hotel, Check in staff unaware of accessibility request made on booking for walk in shower room with bath had been allocated causing delay at reception after long journey on train A suitable room was found for us so we were much relieved 1st floor needs better sound proofing as road noise spoils the experience   Location eventual room layout ,8.1
Strand Palace Hotel, Very small room Noise like someone drilling into the room until I turned off the heating Heating had been left full on with both windows open behind a net curtain Not worth 174 wish I had read more reviews before booking   Complementary water and biscuits Modern but small bathroom ,8.1
Strand Palace Hotel, No parking Wafer thin walls it seemed Radiator wasn t getting warm Executive room Expected a bigger bed   Location is the key Staff efficient Food lovely ,8.1
Strand Palace Hotel, We liked everything but for the benefit of others There was no bath with this room just a double sized shower There s also just a small window with no view   A well placed lovely hotel with friendly and helpful staff We stayed in an Executive King Room 679 which was surprisingly spacious considering other reviews with a wonderful comfortable bed The room had a very quiet and efficient air conditioning unit and so for the first time ever on the first night of an hotel stay we slept like a log Little extras like slippers robes etc made it extra special Breakfast was great too with a good choice on offer We got this room at half price which was excellent value We thoroughly enjoyed our stay here and would definately stay again ,8.1
Strand Palace Hotel,  The location was excellent as it was near to Charing Cross station and also within walking distance of Covent Garden and surrounding theatres and attractions ,8.1
Strand Palace Hotel,  Excellent location Our rooms were spotlessly clean with lovely decor Staff very helpful and friendly Great power shower Wide choice for breakfast that was delicious ,8.1
Strand Palace Hotel, Bed very small in width and length and very uncomfortable And we are not overly tall or overly wide Hotel does not seem like a 4 star  Great location,8.1
Strand Palace Hotel, Standard of hotel room room facilities poor Executive room was equivalent of a high standard B B room not a 4 star hotel   Location of hotel very close to Covent Gardens station,8.1
Strand Palace Hotel, Reception staff were robotic brusque and a little rude I appreciate it was busy at the time but we were made to feel an inconvenience   The bar staff were great and the concierge were helpful ,8.1
Strand Palace Hotel,  Booked this hotel for my parents as part of a theatre break present and they thoroughly enjoyed their stay They were even upgraded to an executive room ,8.1
Strand Palace Hotel, Who designed the handbasin Obviously not anyone who used it Can t wash rinse face without coming into contact with the tap which is too high and reaches too far into the basin   Friendly staff central location high standard of accomodation The complimentary box of chocolates was very much appreciated ,8.1
Strand Palace Hotel, Reception and lounge staff could have been friendlier Accommodation very expensive   Location and reception lounge facilities comfortable accommodation,8.1
Strand Palace Hotel, The room we were given was not at all like the one of that type shown on the website  Location of the hotel was fabulous Staff member Sylwester worked hard to resolve a complaint we made ,8.1
Strand Palace Hotel, Man banged at my door 630 AM claiming to do a Bathroom Check Front desk said he was not with the hotel and had to send security up   Location breakfast cleanliness,8.1
Strand Palace Hotel,  convenience central location for Covent Garden Theatre land and sight seeing Friendly and attentive staff Great breakfast and excellent Sunday lunch in the Carvery ,8.1
Strand Palace Hotel, Just a little point a plastic cup for the bathroom would been very useful   Location excellent our French friends first visit to London loved all hotel excellent on all counts Breakfast superb staff very helpful will definately be booking to come back,8.1
Strand Palace Hotel, Need to put a shower screen up as the shower curtain doesn t do anything and then there is a massive puddle on the floor One had to hold the shower curtain in place whilst the other person had the shower   Breakfast location nicely decorated,8.1
Strand Palace Hotel, The business centre is just computers in the stair well and there was a block on the communication websites I needed for banking and to get into my internet account The reception staff did not know what to do but the IT tech said he would try and unblock it as it happens all the time Perhaps the staff need to know Block the porn but not access for international guests that need to do business in Australia in the middle of the night The night porter let me use his computer which was helpful  Location great and rooms clean restaurants bars good,8.1
Strand Palace Hotel, My partner was not on the booking and was made to pay the full amount upon check in which meant that I didn t have the opportunity to use the gift card I had had   We were welcomed for our anniversary with a bottle of bubbly and a card from the staff Even thought they were busy they were very accommodating and the carver every bit as delicious as the last time and worth every penny ,8.1
Strand Palace Hotel,  The location is excellent minutes from Theatreland We booked in way before advertised check in time we were given a room straight away which was great Comfortable room lovely hotel Staff extremely helpful Will definitely be back again ,8.1
Strand Palace Hotel, The cleanliness of the room wasn t as good as I hoped A dirty plaster was on the carpet and hairs on the walls in the bathroom  The hotel was in a fabulous location,8.1
Strand Palace Hotel, The restaurant floor was greasy I slipped on the grease and fell onto a table dinner Breakfast wasn t very nice   The location is great The staff members evening team at The Carvery were great and so were the receptionists we dealt with ,8.1
Strand Palace Hotel, We paid a lot of money for an executive room but it was extremely tiny and no bigger than a postage stamp The room was located in the middle of the hotel so we had a tiny window that looked out onto a grubby brick wall therefore the room was dark and dingy The bed was also very small Definately not worth the extortionate price   Restaurant staff were very helpful especially when it was very busy at breakfast They were rushed off their feet but always kept calm even when guests were complaining,8.1
Strand Palace Hotel, Although we upgraded to a better room this was located by the lift and vending machine The noise from people talking in the corridor went into the early hours   Great location for the theatres and Covent Garden The room was a good size the bed was comfortable and the shower was powerful ,8.1
Strand Palace Hotel,  Everything It is a lovely traditional hotel with modern facilities The staff make you feel like they care that you are there They are fantastic The rooms are comfortable and the breakfast was very good Room service was excellent ,8.1
Strand Palace Hotel, If you arrive early and would like to get access to your room before 15 00 you have to pay 20 Now if you stay more than one day and decide to wait until 15 00 you are already paying more for your room day 1 than the following days Not so nice  ,8.1
Strand Palace Hotel, The hotel is very busy which means the lobby area is always crowded and noisy The single room I had was very small   I have stayed in the Strand Palace many times and have always found it clean and comfortable The breakfast is very good and the location is great for my purposes ,8.1
Strand Palace Hotel,  The location is fantastic its in the middle of everything I love the hotel I have stayed there twice and wouldn t go anywhere else Staff are lovely and couldn t be more helpful the rooms are good value for money and the food is fantastic ,8.1
Strand Palace Hotel, The room was quite nice the bathroom could use some attention and a new shower head The common areas were run down and the lifts unreliable Quite disappointed   Very good location very friendly staff ,8.1
Strand Palace Hotel, There were always queues at reception The breakfast was too expensive compared to other hotels so we did not partake Although we upgraded our room it was still pretty cramped   Excellent location for the theatres and other attractions Generally well appointed ,8.1
Strand Palace Hotel, We had two rooms as we were a family of four our rooms were too far apart even though we had requested to have rooms near by   Staff were very helpful and professional,8.1
Strand Palace Hotel, The room wasn t ready at the stated check in time But we were given complimentary drinks while we waited  Helpful staff and great location Excellent breakfast ,8.1
Strand Palace Hotel, Room at the front could get a little noisy during the evening   Location to all the attractions and shops we wanted to visit and staff were really helpful and friendly ,8.1
Strand Palace Hotel, nothing  There wasn t anything we didn t like very surprised how well we slept with the room facing the street wooden shutters help to make the room dark and keep the traffic noise out Breakfast was good ,8.1
Strand Palace Hotel, Everything was Fab for our weekend in London   We had a wonderful stay for our shopping weekend in London X Mainly liked how friendly and helpful the staff were and the location was right in the centre of lovely restaurants bars and Cafes Our room was clean not very big but ok for us ,8.1
Strand Palace Hotel, the room were nice but not up to the same Standard as the reception area  The hotel was lovely particularly reception bars and restaurants and staff were helpful and friendly,8.1
Strand Palace Hotel, having paid extra for an executive room the room what we got was more like a standard It was sparsely furnished the bathroom door could only open half way coz it opened against a sink it was a shower over a bath with a rubber mat in very very poor  Very little,8.1
Strand Palace Hotel, Had to wait a long time to be served in Mask Bar not enough seating for size of hotel Also had requested twin room but had to arrange for housekeeper to come and alter beds Thought this should have already been done on our arrival but it didn t inconvenience us   Location perfect for our needs ,8.1
Strand Palace Hotel, This time the room was tiny the roof was above our heads This is awful if you pay about 300 euro per night   The position of the hotel near Covent Garden ,8.1
Strand Palace Hotel, Only issue was nice of air conditioning unit once used and switched off makes a horrible noice  Staff really friendly and hotel was amazing location and food,8.1
Strand Palace Hotel,  The location is excellent So convinient for the theatres and covet garden just round the corner also within walking distances to the shops on Oxford street ,8.1
Strand Palace Hotel, Noise from cleaners in the corridor in the morning and could hear neighbours in adjoining room where there used to be a doorway   Location excellent and clean ,8.1
Strand Palace Hotel, The bedroom size was small and the bed too small Husband had to get out the other side of the bed to go to loo in night having first moved the bed away from wall More like big single rather than double You need to be tidy to know where you put things   helpfulness of all staff to include the men opening the doors for guests,8.1
Strand Palace Hotel, The room was quite cold  I loved everything about this hotel The staff were very friendly breakfast was lovely our room was cosy location is perfect,8.1
Strand Palace Hotel, The breakfast was not very good was cold the toaster didnt really work and it was not all laid out together The tea and coffee was sent back   The location was excellent and the staff very helpful The bed was very comfortable everything clean and fresh ,8.1
Strand Palace Hotel, The room was so small thereasnt enought room for a bedside cabinet The room had an awful noisy generater or aircon fan outside the room fortunately I had some ear plugs which buffered the noise The bed was 2 singles put together when we had booked a double Breakfast was nothing more than chaos We were seated almost on the knees of strangers and the staff were very stressed out Notified reception on checking out but said nothing could be done retrospectively   A very good location but,8.1
Strand Palace Hotel, Bar staff had no manners chamber maids woke us up early in the morning starting their rounds walls were very thin   Location is great the bar is nice,8.1
Strand Palace Hotel, Size of the room was a tad bit small and no view p but don t care much about that since we were mostly out   The staff was extremely friendly and helpful the bellhop was a funny guy we asked for soap and got 4 different kinds Great location Good breakfast ,8.1
Strand Palace Hotel, The queue at check in 20 min waiting the very tired room and hallway decor the 10min wait to be seated for breakfast the very warm room without temperature control The window can be opened but that brings in the buzzing street noise   Very friendly staff on the front desk and in the breakfast room trying to make the best of an outdated hotel ,8.1
Strand Palace Hotel, The staff were unfriendly The room was vey small The decor was jaded I was put in a room that had the bottom of the window backed out   The location was very good closes to west end and convent garden ,8.1
Strand Palace Hotel, Having stayed at hotel several times previously on a B B basis when in London on business I have always enjoyed the breakfast However when booking independently I thought the price excessive bearing in mind I got a full English breakfast at Garfunkel s next door for 5 99 less thana third than the hotel were charging  Location next to Covent Garden tubes and bus routes Also staff friendly and helpful room clean and lovely feeling about the hotel,8.1
Strand Palace Hotel, Budget room fine for a one night stay but would not want to stay more than overnight Bar prices higher than expected for this hotel Absolutely no view   Location Breakfast Staff,8.1
Strand Palace Hotel,  Everything From the moment we were checked in by a very friendly and efficient member of staff to the room which overlooked the Strand and the comfortable bed and very clean room and bathroom ,8.1
Strand Palace Hotel, The bed was most uncomfortable with a very hard mattress and pillows but were told they were new We were offered a topper next day but we were only stopping the one night Suggest a note offering this in the bedroom would be a good idea The breakfast would have been very good had the plates not been cold It was a special treat for my husband s birthday and left feeling a bit let down   The hotel is very conveniently placed for Whitehall where we needed to be on Sunday 15th ,8.1
Strand Palace Hotel, London prices are crazy Room very cold on arrivale as radiators turned off and window open It son warmed up once I turned on teh heating   Fine position clean comfortable Room with good facilities,8.1
Strand Palace Hotel, My room smelled like fried eggs because of kitchen fumes coming from the street Hotel staff took 4 hours to change me to another room and only after I called 3 times Had to escalate the problem to a manager   Breakfast and location are great ,8.1
Strand Palace Hotel, The twin room was very tight for space I felt it was very rude for a staff member not to complete an order or at least apologise for needing to hand over to another staff member   The location the staff were helpful The environment was welcoming and smelt lovely,8.1
Strand Palace Hotel, Dining room has too many tables squashed into a small space Breakfast is a scrum and evening dining is uninviting so we went elsewhere   Double room was small but well equipped ,8.1
Strand Palace Hotel, Having to move rooms as the aircon which we paid extra for wasn t working The Strand is a busy place and an open window is not an option   No lengthy queues plenty of staff in a clean and tidy environment Buffet breakfast was pleasant ,8.1
Strand Palace Hotel, Rooms on the front were a little noisy with the traffic on the Strand   Excellent staff and service second to none well organised even at busy times Excellent location for all West End attractions ,8.1
Strand Palace Hotel, Very small room They tried to overcharge us at the lounge bar Not good service at the bar it took so much time to give an order and have a drink Also the Nook bar and the Gin cocktail bar was closed during the hole day   Very nice location close to most important sights in London,8.1
Strand Palace Hotel, Bad organization of check in process more than 30 minutes waiting The shower is fixed The size of the bathroom was bigger than the size of the room No mini fridge in the room The towels were shabby In general The hotel is overrated  Location,8.1
Strand Palace Hotel, We didn t like the position of the bed it was a very small room which was fine we had all we needed however the bed was in a corner and one us had to be against the wall we tossed a coin and guess who lost   Great location for the event that we were attending ,8.1
Strand Palace Hotel,  We went to London to see a couple of shows and the location of this hotel was excellent It made getting there easy and the central location meant sight seeing was easy too The upgrade we made to the rom meant it was spacious and comfortable,8.1
Strand Palace Hotel,  Very helpful staff great location for watching Spectre in Leicester Square and veiwing Bond in Motion round the corner Can recommend executive king room with a la carte breakfast lovely ,8.1
Strand Palace Hotel,  Simple but clean room Surprisingly quiet considering it was the middle of The Strand in London Excellent breakfast included in the overnight price ,8.1
Strand Palace Hotel, It was like living in Victoria Station during rush hours Constant queues for lifts reception and even breakfast Slow internet connection Room service beginning to work at 8 am due to a huge number of rooms on each floor Of course doors were not sound proof Thanks but no thanks   Location Room Cleanliness Friendly staff,8.1
Strand Palace Hotel, A bit overpriced and the reception lady wasn t very welcoming It was my birthday too so just a bit of an anti climax   The bed was so comfy and had a fantastic sleep It was a nice hotel all in all but I don t think it was worth the price I paid ,8.1
Strand Palace Hotel,  My daughter let the hotel know it was my birthday We were given an upgraded room ready at 11am with lots of extras eg Prosecco my favourite sweets etc and it made it all very special ,8.1
Strand Palace Hotel, Rom too hot and very noisy had no sleep Glass broken at bar and not cleared up for ages Trying to get attention of staff for breakfast Not good Expressed disatissfaction on checkout didnt seem to care   Location,8.1
Strand Palace Hotel, The checking in was really poor We had booked 7 rooms and it took forever for the check in process Very disorganised even though we had all the relevant confirmations with us  The location of the hotel,8.1
