Hotel_Name,Full_Review,Average_Score
Hilton London Olympia, Corridors from lifts to rooms looked tired old but room was modern clean 15 minute walk from Earls Court tube station 15 20 min tube ride into the centre of London  Nice bar with friendly staff decent menu,7.4
Hilton London Olympia, The beds weren t very comfy in one of them the springs had been damaged sp was uncomfortable on my back just thought the room was a little basic  The overall layout of the room was convenient along with fresh sheets and the compliments left ,7.4
Hilton London Olympia, The air conditioner did not work in the first night but our request for room change was refused To be fair the hotel got us a new room with working air conditioner the next day after we complained again   Fast check in request for late check out granted,7.4
Hilton London Olympia, The bathroom floor didn t look very clean old water soap marks Room generally very ordinary More than 10 minutes from tube It would have been helpful to know about the bus from the tube to the hotelwhich we found out about too late  staff were very helpful and friendly Reception area and bar very well presented,7.4
Hilton London Olympia, Prices in main bar double rum and coke double Baileys 12 60 in the Hand and Flower 200 yards away 23 80 in hotel rather excessive Dirty cutlery at breakfast had to try 3 forks before I got a clean one   Comfortable room beds Executive Lounge facility,7.4
Hilton London Olympia, The hotel was is tired needs updating but even though i will never stay there again it was fair value for london 140  Location was where i needed to be,7.4
Hilton London Olympia, Booked twin bed non smoking room On arrival had to accept double bed smoking room Given free breakfast Would rather have had what was booked   Free breakfast ,7.4
Hilton London Olympia, I believe that the entire staff s performance made up for the dated decor and aged facilities They really deserve a venue worth their efforts   Staff attitude and performance was excellent The food at dinner and breakfast was tasty and of high quality and served with a smile ,7.4
Hilton London Olympia, Everything carpet to begin and rooms and everything it is old old old old  Horrible i would not even rate this hotel 1 star maybe close to a hostel terrible terrible terrible,7.4
Hilton London Olympia, Too long to checkin Room was not cleaned to good standard Room Service was directed to a mailbox turned off General helpfulness of staff was unsatisfactory ,7.4
Hilton London Olympia, Check in under staffed TV Didn t work Furniture out of place and from the 70 s Poor lighting Bed Awful Bathroom generally poor Shower a joke I could go on ,7.4
Hilton London Olympia, Where to start room ok however couldnt even stand up in the shower and the ceilings were so low Spoke to reception and was told we have another room but its not as nice as the one you are in Paint peeling off door frame and skirting boards tv kept switching itself on and off window wouldnt shut properly so it sounded like we were asleep on the street as it was a main road outside Bar staff very rude tried charging us 18 for 2 Baileys this is meant to be served as a 50ml however they were serving it as a 25ml when i tried to explain this to the bar manager he just said no and walked away For what we paid i would have liked a little more luxury Safe to say we wont be staying there again   Location,7.4
Hilton London Olympia, The location and the staff  Location is very good and close to all the activities Bus station is next to the hotel Staff are outstanding The hotel room is clean and and well maintained Bathroom very small and outdated,7.4
Hilton London Olympia, Would have been nice to have a bit more room and have television on wall at end of beds rather than off to one side of the room   Beds were really comfortable Breakfast was excellent Restaurant and reception staff were brilliant ,7.4
Hilton London Olympia, Lumpy beds 10 minutes to run hot water 1st day concierge moved me out of the way of the lifts for another customer with more bags Had 2 meals in the restaurant and both were not cooked properly and waited 15 minutes just to get a drink and a menu  ,7.4
Hilton London Olympia, Breakfast is very good but very very expensive although rooms good value overall B B is reasonable for London Some rooms on road side suffer quite alot of noise from road Decided to eat in Hotel one night because so wet outside to go anywhere else Food choice limited and service slow   Stayed while exhibiting at Olympia Location is excellent for Olympia for for Kensington using the buses Proximity to Tube poor as Olympia is such an out of the way tube station ,7.4
Hilton London Olympia, We arrived and room was not ready this was 7 30pm and check in was after 2pm Moved to another executive room as per our booking and as we were trying to get comfortable after our journey there were staff in our room separating beds and putting sheets on etc We went to the executive lounge at 8 15pm this was supposed to be open until 9pm but they were already clearing the food etc so again not very welcoming We expected far better than this having booked a twin executive suite very disappointed   Location,7.4
Hilton London Olympia, The rooms do not live up to the front of house They are tired a little fur coat not knickers I m afraid   The location is perfect for the Olympia,7.4
Hilton London Olympia, The mattress seemed to have had its day The noise from the road and train was a little louder than expected   The Executive lounge was well stocked with lots of choice Staff were friendly and the room was comfortable ,7.4
Hilton London Olympia, I would have expected a complimentary bottle of water in the room Although a Hilton Honors customers I was unable to get wifi signal   Very comfortable bed ,7.4
Hilton London Olympia, 1 My room was not ready for occupation when I arrived at approximately 3 50pm 2 I was sent to 3 rooms one of which was in a noisy position above a major road in breach of my booking arrangement and two of which were not made up before being accommodated in a forth slightly up graded room I had to queue at reception each time I eventually ended up in a room with a severely cracked sink tepid hot water in the morning around 7 am and a very squeaky bed   The Position of the hotel near Olympia and well prepared food ,7.4
Hilton London Olympia, Reception told me my debit card had been declined with booking com and wanted a credit card instead I refused so they took payment on my debit card which has ample funds that was very disgusting of them for me to be told my card was declined when it was fine room service was appaulingly slow also the room was very small for a double   very good breakfast,7.4
Hilton London Olympia, Wasn t happy with the meal we ordered in the evening steak wasn t that nice at all and we gave our room number then went up to bed and after a little while we were being called several times in the room to go back and pay the bill The breakfast was also not particularly nice and so we didn t really enjoy it at all I have also filled in a complaint form  ,7.4
Hilton London Olympia, Nothing  All the staff were very helpful when we arrived the room was lovely the b fast was great you had the chose of full english toast fruit ham cheese salad everything you could want to keep you going all day I would recommend this hotel to all my friend I would just like to say a big thank you to all the staff for making are stay fantastic ,7.4
Hilton London Olympia, Our 2nd floor bedroom was situated to the front side of the hotel It was really noisy being so close to the road with sirens and fast cars It made it difficult to sleep Also it needed more staff at peak times i e Evening room service and morning check out   It s close location to Olympia with parking facilities ,7.4
Hilton London Olympia, The room felt very small and thankfully I was on my own so that was sufficient However if I travelled with my husband we would have struggled for space Good enough for one night in London   Convenient location and lovely staff,7.4
Hilton London Olympia, TV remote didn t always work possibly needs new batteries 1 50 for a bottle of water It was free at the Hilton Heathrow You want to economise on laundry but the handwash soap gets changed daily   Breakfast,7.4
Hilton London Olympia, mini bar and tray controlled by computer don t touch anything or you will be charged if it happen just talk to the reception  very helpful staff We got the room in the morning and could drop the baggage surrounding are nice too,7.4
Hilton London Olympia, This hotel is very convenient for Olympia but less so if you need to get to anywhere else in London   Not luxurious but perfectly comfortable enough for a couple of nights ,7.4
Hilton London Olympia, Not much as I said the room was comfortable but some bits were a bit tired bath enamel was chipped and bath panel has signs of water damage   Room was comfortable and clean breakfast was good with plenty of variety and staff were friendly and helpful,7.4
Hilton London Olympia, Loud disco until late on due to a function kept my son and I awake The room was a bit tired and in need of modernisation Bath with shower over was cramped and I had to stoop to wash my hair as my head touched the ceiling   Nice big comfy bed good sized room excellent breakfast Good location a short walk from tube station ,7.4
Hilton London Olympia, The hallways to the rooms might need a little touch up but not important everything else very good  Very happy over all with the stay lovely staff and awesome brekfast very comfortable in this hotel,7.4
Hilton London Olympia, Unfortunately this hotel just needs to be refurbished or at least replace the mattresses They are awful and have really bad spring problems in both of the rooms we tried after being moved We were told that all of the mattresses are the same Considering I stay at the Hilton in numerous locations this was a real let down and I believe I should have been refunded I even went away with a bad ache   The service from the staff was excellent and they tried to help as best as they could which was a delight ,7.4
Hilton London Olympia, The decor very dated the furniture My bedroom is100 better expected a lot from the HIlton but the luxury was not there for the price I paid It was like a cheap cheap hotel Holiday Inn would have been better and cheaper  Staff and loby,7.4
Hilton London Olympia, The bathrooms are tiny the bedroom was tired and did not live up to executive status  The executive lounge was very welcoming and made up for a lot of other things,7.4
Hilton London Olympia, stained cracked bath and bathroom very tired and jaded indifferent staff overpaid for parking lifts broken roof tiles in bathroom broken and miss fitting clock radio broken a travelodge would have been much better in terms of cleanliness and decor ,7.4
Hilton London Olympia, Breakfast was very pricey at nearly 20 per head They offer a 5 credit off your restaurant or room service bill if you forgo room service for a day but BEWARE It does not appear that housekeeping are very good at passing this information on to the billing department They did not automatically add the credit to our bill and when we queried this with the girl at reception although pleasant she appeared quite reluctant to accept that this was an error on their part In the end she disappeared for five minutes and returned and confirmed it would be taken off our bill but there was no apology or admission that they had made an oversight in the first place Our advice would be to make sure you tell reception if you decide to do this as although they just say that you simply need to place the hanger on your door that information probably will not make it onto your bill Rooms whilst clean appear to be quite drab and tired and the lifts were extremely unreliable Also our bed was very hard and uncomfortable which was quite disappointing considering the room rate and the fact that they upgraded us on arrival   Breakfast choice and service was excellent Also the burgers we had in the evening on our first night were amongst the best we have ever had The majority of the staff were all very polite well trained and helpful Money had clearly been invested in the restaurant and public areas which are in stark contrast to the corridors and rooms above ,7.4
Hilton London Olympia, Plugs   Junior suite was great with lots of room and windows made it light and airy beds comfy Not very many plugs bathroom clean with everything you need Breakfast great spoilt for choice Great location for the museums ,7.4
Hilton London Olympia, Bar prices far too expensive One lift out of order causing problems with a full hotel Bedroom corridors bit dated and tired Access to carpark dark dingy Insufficient staff for busy checkouts  Excellent location for Olympia Bedroom small but adequate lovely modern refurbed bathroom beds quite comfy Society bar and restaurant very nice,7.4
Hilton London Olympia, Client can t turn off air conditioner the other one is very tall but taken to a room with small bed fell down to ground in the deep sleep Their bathrooms are not clean enough to stay compared with their past experiences in Hilton Said would send a solving e mail to us haven t received until now  ,7.4
Hilton London Olympia, A member of staff let themselves into our room after we had checked in and were in the room I met him in the doorway and he immediately said he had the wrong room Left me feeling a bit suspicious   it was convenient for the exhibition centre and close to a Byron s restaurant ,7.4
Hilton London Olympia, Honestly nothing I could fault Id highly recommend and stay there again   Helpful friendly staff nice clean comfy rooms and easy to hop on the bus or catch the train nearby,7.4
Hilton London Olympia, Update the rooms   The room was a little dated The furniture seemed quite old but it was all clean and comfortable The breakfast was amazing and the staff were great Service excellent ,7.4
Hilton London Olympia, Waiting times at check in never enough staff Lifts constantly out of order   Breakfast were superb All staff were so very helpful Easy walk to Kensington Shepherds Bush Westfields etc Staff member BEVAN was so so nice and very professional Thank you ,7.4
Hilton London Olympia, Exorbitant price of room Room was not available until 7 30pm which after a 14 hour day was unacceptable Minibar not stocked even though requested 3 times Reason was hotel was too busy Decor in room was worn tired and in need of overhaul   Proximity to trade show at Olympia great staff surprisingly low prices in the bar restaurant executive Lounge ,7.4
Hilton London Olympia, Dated and dull room whole Hotel although modern downstairs had a dark Dark and dull appearance almost everywhere Bed was comfortable cover was stained but clean however constant sound of Police ambulance sirens every night made it difficult to sleep Towells did not smell fresh Stained floor around toilet Dirty food trays left in corridor for 2 days Couldn t eat any bacon or sausage for breakast as it was fatty contained gristle Most expensive piece of toast and cup of tea I have ever bought 2 breakfasts Way more expensive and difficult to get to Covent Garden every day than the impression given Ended up spending average of 45 per day on cabs Would have been more expensive if hotel had booked them Couldnt cancel rest of the week as I used Booking com will never use them or Hilton Hotels again   The staff on reception were extremely helpful ,7.4
Hilton London Olympia, 2 of the lifts were not working mini bar not stocked this is poor in any hotel let alone a decent one view from window absolutely shocking suggest you make sure you request a decent view  Decent location good for buses and tube to all locations Breakfast excellent ,7.4
Hilton London Olympia, Tea and Coffee facilities were a little sparse Also due to fridge being weighted for mini bar couldn t cool our own prosecco   Very friendly staff Quiet rooms Blissful sleep ,7.4
Hilton London Olympia, Car parking charges astronomical room tiny room prices set for lottery winners only empty non working mini bar shower pressure a joke air con not working lifts constantly broken The bath was old repaired and filthy   Close to Olympia,7.4
Hilton London Olympia, VAT receipt available on arrival it held up my expenses claim  Didn t have breakfast in hotel but found room was very comfortable staff were friendly and helpful ,7.4
Hilton London Olympia, everything room disgusting booked an upgrade for my anniversery but should have booked a traveldoge as much better would like a full refund   nothing,7.4
Hilton London Olympia, Two elevators out of three were out of order during my stay which made it Difficult to go up and down as I was staying in the 7th floor the problem was not solved until l left the hotel Breakfast in executive lounge was not that great and in general the lounge food and drinks supply during the day or the happy hours 6 to 8 pm were that not great The noise of the trains can be heared in the room even during night  All Hotel staff are very friendly,7.4
Hilton London Olympia, The very nice male staff at the desk told me I would have water in my room when the only drinks in the mini bar were alcoholic beverages and energy drink The lock on the door would not turn when the door was closed but I figured out the trick to do so The air conditioning had no off button switch The noise from the road was awful I could hear the cars passing in the street below my third floor window as if the window was open There were stairs in the corridor leading to my room  ,7.4
Hilton London Olympia, The receptionist checked us in late due to availability of the room and waited for so long Also the two lifts were not working during our stay   I love how the Concierge assisted us the whole stay The two albanian gentlemen staff were so helpful and accomodating Hats off to them ,7.4
Hilton London Olympia, Arrived at 15 30 but didn t check in until 45 minutes later as been told by the staff that room wasn t ready Very small bathroom for a standard room and the television was really out of date as I didn t even know how to turn it on and some of the lights doesn t work in the room   location,7.4
Hilton London Olympia, The staff were rude and the concierge wouldn t give us any information about how to get around London The toilet was broken on arrival and it took three phone calls before anything was done and eventually somebody came up at 11 30pm so we had to wait up until they left before we could sleep and we had driven for 8 hours On the second day we got back at 3 30pm to get ready for going to the lion king that night however we got back to the room and housekeeping had not been in I called down to say we were in a rush and wanted showers with no clean towels it took them half an hour to get us towels meaning we didn t have time for a shower before we went out for the night The next day when we returned there was a handyman in the bathroom retiling the bathroom he left after using all the toilet roll for god knows what and the bathroom was a mess from the materials he was using to re tile There was only 1 lift working for the whole hotel for the duration of our stay which meant we had to wait for roughly 5 10 mins every time When house keeping did come I asked the staff member for towels and to not bother cleaning the room she said she didn t speak English and came into the room and started cleaning around us The room we were allocated too had boilers air vents outside that were very noisy all night so gave us a disturbed sleep When going for breakfast we put a do not disturb sign on the door as we had money ipads phones lying around and when we came back from breakfast someone was in our room Overall the stay was absolutely horrific and as a Hilton honours member I am so disappointed that I will probably never stay in a Hilton again   Sandra who worked in the bar ,7.4
Hilton London Olympia, No underground station nearby other than the very intermittent service from Olympia and a 15 minute walk to Kensington High Street Tired Air conditioning   Excellent position for visiting Olympia exhibition halls Polite helpful staff Large comfortable double bed 5 pub over the road the Warwick Arms Good Hilton breakfast in the morning ,7.4
Hilton London Olympia, The tube station which should have been the closest seems to not be in use So we got off at Earls Court but it is better to get off at High Street Kensington as its more straight forward I hoped for a better view from the room as it is in a nice part of London but instead we looked over the back of the hotel where the bins were and we couldn t open the window very much The room was fine it was clean but I felt needed a bit of something to brighten it up   The hotel room was ready when we arrived at 1pm which was a bonus We didn t pay for breakfast there as there was plenty of alternatives on the High Street and this made us get up and out to make the most of the day The bar area is very nice and it is handy that there is a costa coffee under the hotel Staff very friendly and pleasant Plenty of restaurants and bars a short walk away We went for the carnival so it was a good location for us ,7.4
Hilton London Olympia, The breakfast seems to be expensive so we didn t even bother to try it   We arrived earlier before the official check in time however the staff was able to help us to get a room so we can take a rest after a 6 hour flight we contacted them via booking com earlier though The location is pretty great We have 7 day Oyster travel cards so we can either take a bus in which the stop is within a minute or arrive the nearby tube station high street Kensington via the bus Within walking distance of 10 15 minutes there is a 24 hour Tesco in which you can buy groceries Feeling pretty safe in the neighborhood The room was a bit old but no complaint as it is normal for hotels in big cities e g NYC The washroom is pretty new and in generally we had a great stay thanks for the comfy hotel and great location ,7.4
Hilton London Olympia, Don t like the tray of drinks in the room that if moved are charged to the room   The beds were very comfortable Breakfast was great with a great selection of hot and cold waited on by very friendly staff The rooms are cleaned by very good housekeeping staff ,7.4
Hilton London Olympia,  I booked a smoking room and when we checked in they give us room 874 at eighth floor and when we get that floor I saw member of staff and asked her where is 874 and she took us there in the hallway to that room smell horrible and when I open the door even worse we couldn t breath and I turn on the air conditioning and opened the windows and lay down on the bed and It was disgusting bed linens was smell deeply smoking something different to the sigarette anyway my wife called the front desk and told the about the situation and asked them at least spray some air freshener before give it to your guests and they just changed our room but no smoking and smaller room 144 few weeks before I had similar room in Hilton Holland Park it was clean the air conditioning was much better and powerful the bathroom was more clean carpet was more clean so I never go back to Hiton Olampia never,7.4
Hilton London Olympia, There was an air of self importance from the other guests which is no fault of the hotel They were brusque to the point of rudeness towards the staff who were very tolerant of them   The bed was amazingly comfortable a delight to sleep in Cocktail staff were excellent and imaginative We felt very looked after ,7.4
Hilton London Olympia, Need more milk in hotel room as only enough for one cup of coffee  Beautiful breakfast Frederico on the front desk was especially kind and his service was wonderful ,7.4
Hilton London Olympia, A nice hotel staff were excellent very helpful and room was clean   The bed was uncomfortable we did mention this to staff and they promised they wold look into it and we were offered free breakfast which was lovely ,7.4
Hilton London Olympia, Myself and my friend accidently left some items of clothes in the wardrobe which were subsequently stolen by a member of staff Despite numerous phone calls and emails to the hotel we are now three weeks later and we have not once been contacted by the hotel to rectify this crime Do not stay here if you value your belongings as they seem shockingly unconcerned that they employ thieves   Good location near to Olympia ,7.4
Hilton London Olympia, Sorry put a lot of it in the good things Bed un comfortable so hard gave me back pain was shuffling in bed a lot No prices on mini bar No free WiFi   Location was fine not too far to walk Staff were friendly Exterior looks posh bed very uncomfortable Air conditioning was nice but loud No prices on mini bar or tray to give you a clue of what charges you d get so I didn t use it No free WiFi which was kind of bad for being in a huge city large hotel yet they couldn t offer it The halls went on forever as the place was huge and there was a drunk women disturbing the peace and no staff around to report to The house keeping staff were amazing and lovely and would rate them every time They need a raise for being so kind and helpful ,7.4
Hilton London Olympia, It was difficult to connect to wifi Signal was very weak Maybe because my room was the last in the corridor   Hotel is a little bit old but in general the rest is very ok Very pleasant and helpful personnel Rooms to the main street is quite noisy ,7.4
